"No.","Time","Source","Destination","Protocol","Length","Destination Port","Source Port","Info"
"1","0.000000000","91.189.91.49","172.20.10.8","TCP","66","","","80  >  57988 [ACK] Seq=1 Ack=1 Win=47 Len=0 TSval=2238364533 TSecr=3368570885"
"2","0.000000134","91.189.91.49","172.20.10.8","TCP","54","","","80  >  57988 [RST] Seq=0 Win=0 Len=0"
"3","0.000000169","91.189.91.49","172.20.10.8","TCP","54","","","80  >  57988 [RST] Seq=1 Win=0 Len=0"
"4","0.578991029","fe80::e06d:17ff:fe99:5b64","ff02::1","ICMPv6","142","","","Router Advertisement from e2:6d:17:99:5b:64"
"5","0.589080987","fe80::a359:e5d7:b650:2be6","ff02::16","ICMPv6","150","","","Multicast Listener Report Message v2"
"6","1.128600780","fe80::a359:e5d7:b650:2be6","ff02::16","ICMPv6","150","","","Multicast Listener Report Message v2"
"7","2.071150118","172.20.10.8","172.20.10.1","DNS","89","53","37882","Standard query 0x426b A a.config.skype.com OPT"
"8","2.071239302","172.20.10.8","172.20.10.1","DNS","89","53","52115","Standard query 0x354c AAAA a.config.skype.com OPT"
"9","2.137328813","172.20.10.1","172.20.10.8","DNS","241","37882","53","Standard query response 0x426b A a.config.skype.com CNAME skypeecs-prod-edge-a.trafficmanager.net CNAME l-0007.config.skype.com CNAME config-edge-skype.l-0007.l-msedge.net CNAME l-0007.l-msedge.net A 13.107.42.16 OPT"
"10","2.141981528","172.20.10.1","172.20.10.8","DNS","253","52115","53","Standard query response 0x354c AAAA a.config.skype.com CNAME skypeecs-prod-edge-a.trafficmanager.net CNAME l-0007.config.skype.com CNAME config-edge-skype.l-0007.l-msedge.net CNAME l-0007.l-msedge.net AAAA 2620:1ec:21::16 OPT"
"11","2.185125972","172.20.10.8","172.20.10.1","DNS","85","53","56397","Standard query 0x9694 A pipe.skype.com OPT"
"12","2.185193432","172.20.10.8","172.20.10.1","DNS","85","53","59021","Standard query 0x03c2 AAAA pipe.skype.com OPT"
"13","2.185773313","172.20.10.8","13.107.42.16","TCP","74","","","44820  >  443 [SYN] Seq=0 Win=64240 Len=0 MSS=1460 SACK_PERM=1 TSval=2202758718 TSecr=0 WS=128"
"14","2.211367680","13.107.42.16","172.20.10.8","TCP","74","","","443  >  44820 [SYN, ACK] Seq=0 Ack=1 Win=23808 Len=0 MSS=1410 SACK_PERM=1 TSval=2497925531 TSecr=2202758718 WS=512"
"15","2.211392707","172.20.10.8","13.107.42.16","TCP","66","","","44820  >  443 [ACK] Seq=1 Ack=1 Win=64256 Len=0 TSval=2202758744 TSecr=2497925531"
"16","2.211812850","172.20.10.8","13.107.42.16","TLSv1.2","323","","","Client Hello"
"17","2.222306139","172.20.10.1","172.20.10.8","DNS","210","56397","53","Standard query response 0x9694 A pipe.skype.com CNAME global.aria.events.data.trafficmanager.net CNAME onedscolprdwus13.westus.cloudapp.azure.com A 20.189.173.14 OPT"
"18","2.246250755","13.107.42.16","172.20.10.8","TCP","66","","","443  >  44820 [ACK] Seq=1 Ack=258 Win=25088 Len=0 TSval=2497925569 TSecr=2202758744"
"19","2.251473857","172.20.10.1","172.20.10.8","DNS","264","59021","53","Standard query response 0x03c2 AAAA pipe.skype.com CNAME global.aria.events.data.trafficmanager.net CNAME onedscolprdwus13.westus.cloudapp.azure.com SOA ns1-02.azure-dns.com OPT"
"20","2.251728851","172.20.10.8","172.20.10.1","DNS","113","53","35353","Standard query 0x5559 AAAA onedscolprdwus13.westus.cloudapp.azure.com OPT"
"21","2.257331072","172.20.10.1","172.20.10.8","DNS","183","35353","53","Standard query response 0x5559 AAAA onedscolprdwus13.westus.cloudapp.azure.com SOA ns1-02.azure-dns.com OPT"
"22","2.257334357","13.107.42.16","172.20.10.8","TCP","2862","","","443  >  44820 [PSH, ACK] Seq=1 Ack=258 Win=25088 Len=2796 TSval=2497925573 TSecr=2202758744 [TCP segment of a reassembled PDU]"
"23","2.257368216","172.20.10.8","13.107.42.16","TCP","66","","","44820  >  443 [ACK] Seq=258 Ack=2797 Win=61568 Len=0 TSval=2202758789 TSecr=2497925573"
"24","2.257334394","13.107.42.16","172.20.10.8","TLSv1.2","1440","","","Server Hello, Certificate, Server Key Exchange, Server Hello Done"
"25","2.257382478","172.20.10.8","13.107.42.16","TCP","66","","","44820  >  443 [ACK] Seq=258 Ack=4171 Win=60288 Len=0 TSval=2202758790 TSecr=2497925573"
"26","2.258865682","172.20.10.8","13.107.42.16","TLSv1.2","224","","","Client Key Exchange, Change Cipher Spec, Encrypted Handshake Message"
"27","2.258999709","172.20.10.8","20.189.173.14","TCP","74","","","35698  >  443 [SYN] Seq=0 Win=64240 Len=0 MSS=1460 SACK_PERM=1 TSval=3095526094 TSecr=0 WS=128"
"28","2.279295299","20.189.173.14","172.20.10.8","TCP","74","","","443  >  35698 [SYN, ACK] Seq=0 Ack=1 Win=23808 Len=0 MSS=1410 SACK_PERM=1 TSval=3403575654 TSecr=3095526094 WS=512"
"29","2.279316984","172.20.10.8","20.189.173.14","TCP","66","","","35698  >  443 [ACK] Seq=1 Ack=1 Win=64256 Len=0 TSval=3095526114 TSecr=3403575654"
"30","2.279639916","172.20.10.8","20.189.173.14","TLSv1.2","319","","","Client Hello"
"31","2.291106598","13.107.42.16","172.20.10.8","TLSv1.2","408","","","New Session Ticket, Change Cipher Spec, Encrypted Handshake Message"
"32","2.292849354","172.20.10.8","13.107.42.16","TLSv1.2","360","","","Application Data"
"33","2.311232473","20.189.173.14","172.20.10.8","TCP","66","","","443  >  35698 [ACK] Seq=1 Ack=254 Win=25088 Len=0 TSval=3403575686 TSecr=3095526115"
"34","2.360958201","13.107.42.16","172.20.10.8","TCP","66","","","443  >  44820 [ACK] Seq=4513 Ack=710 Win=27136 Len=0 TSval=2497925684 TSecr=2202758825"
"35","2.525970624","13.107.42.16","172.20.10.8","TLSv1.2","1304","","","Application Data"
"36","2.525970739","13.107.42.16","172.20.10.8","TCP","66","","","443  >  44820 [FIN, ACK] Seq=5751 Ack=710 Win=27136 Len=0 TSval=2497925811 TSecr=2202758825"
"37","2.529559860","172.20.10.8","13.107.42.16","TLSv1.2","97","","","Encrypted Alert"
"38","2.532629180","172.20.10.8","13.107.42.16","TCP","66","","","44820  >  443 [FIN, ACK] Seq=741 Ack=5752 Win=64128 Len=0 TSval=2202759065 TSecr=2497925811"
"39","2.545310345","13.107.42.16","172.20.10.8","TCP","66","","","[TCP Out-Of-Order] 443  >  44820 [FIN, ACK] Seq=5751 Ack=710 Win=27136 Len=0 TSval=2497925868 TSecr=2202758825"
"40","2.545364838","172.20.10.8","13.107.42.16","TCP","78","","","[TCP Dup ACK 37#1] 44820  >  443 [ACK] Seq=742 Ack=5752 Win=64128 Len=0 TSval=2202759077 TSecr=2497925868 SLE=5751 SRE=5752"
"41","2.555421748","13.107.42.16","172.20.10.8","TCP","78","","","[TCP Dup ACK 34#1] 443  >  44820 [ACK] Seq=5752 Ack=710 Win=27136 Len=0 TSval=2497925877 TSecr=2202758825 SLE=741 SRE=742"
"42","2.555421887","13.107.42.16","172.20.10.8","TCP","78","","","443  >  44820 [ACK] Seq=5752 Ack=742 Win=27136 Len=0 TSval=2497925877 TSecr=2202759062 SLE=741 SRE=742"
"43","2.600561518","20.189.173.14","172.20.10.8","TCP","1464","","","443  >  35698 [ACK] Seq=1 Ack=254 Win=25088 Len=1398 TSval=3403575973 TSecr=3095526115 [TCP segment of a reassembled PDU]"
"44","2.600579410","172.20.10.8","20.189.173.14","TCP","66","","","35698  >  443 [ACK] Seq=254 Ack=1399 Win=63104 Len=0 TSval=3095526436 TSecr=3403575973"
"45","2.606185819","20.189.173.14","172.20.10.8","TCP","1464","","","443  >  35698 [PSH, ACK] Seq=1399 Ack=254 Win=25088 Len=1398 TSval=3403575973 TSecr=3095526115 [TCP segment of a reassembled PDU]"
"46","2.606201211","172.20.10.8","20.189.173.14","TCP","66","","","35698  >  443 [ACK] Seq=254 Ack=2797 Win=63104 Len=0 TSval=3095526441 TSecr=3403575973"
"47","2.606185939","20.189.173.14","172.20.10.8","TCP","1464","","","443  >  35698 [ACK] Seq=2797 Ack=254 Win=25088 Len=1398 TSval=3403575974 TSecr=3095526115 [TCP segment of a reassembled PDU]"
"48","2.606223663","172.20.10.8","20.189.173.14","TCP","66","","","35698  >  443 [ACK] Seq=254 Ack=4195 Win=61824 Len=0 TSval=3095526441 TSecr=3403575974"
"49","2.606326477","20.189.173.14","172.20.10.8","TLSv1.2","378","","","Server Hello, Certificate, Server Key Exchange, Server Hello Done"
"50","2.606331241","172.20.10.8","20.189.173.14","TCP","66","","","35698  >  443 [ACK] Seq=254 Ack=4507 Win=61568 Len=0 TSval=3095526441 TSecr=3403575974"
"51","2.607507165","172.20.10.8","20.189.173.14","TLSv1.2","224","","","Client Key Exchange, Change Cipher Spec, Encrypted Handshake Message"
"52","2.635238070","20.189.173.14","172.20.10.8","TCP","66","","","443  >  35698 [ACK] Seq=4507 Ack=412 Win=26112 Len=0 TSval=3403576010 TSecr=3095526443"
"53","2.832979279","20.189.173.14","172.20.10.8","TLSv1.2","117","","","Change Cipher Spec, Encrypted Handshake Message"
"54","2.833675323","172.20.10.8","20.189.173.14","TLSv1.2","1426","","","Application Data"
"55","2.877241188","20.189.173.14","172.20.10.8","TCP","66","","","443  >  35698 [ACK] Seq=4558 Ack=1772 Win=28672 Len=0 TSval=3403576252 TSecr=3095526669"
"56","3.243031067","20.189.173.14","172.20.10.8","TLSv1.2","556","","","Application Data"
"57","3.243161514","20.189.173.14","172.20.10.8","TCP","66","","","443  >  35698 [FIN, ACK] Seq=5048 Ack=1772 Win=28672 Len=0 TSval=3403576412 TSecr=3095526669"
"58","3.243161540","20.189.173.14","172.20.10.8","TCP","66","","","[TCP Out-Of-Order] 443  >  35698 [FIN, ACK] Seq=5048 Ack=1772 Win=28672 Len=0 TSval=3403576484 TSecr=3095526669"
"59","3.243184474","172.20.10.8","20.189.173.14","TCP","78","","","35698  >  443 [ACK] Seq=1772 Ack=5049 Win=64128 Len=0 TSval=3095527078 TSecr=3403576412 SLE=5048 SRE=5049"
"60","3.243492743","172.20.10.8","20.189.173.14","TLSv1.2","97","","","Encrypted Alert"
"61","3.243827340","172.20.10.8","20.189.173.14","TCP","66","","","35698  >  443 [FIN, ACK] Seq=1803 Ack=5049 Win=64128 Len=0 TSval=3095527079 TSecr=3403576412"
"62","3.285525821","20.189.173.14","172.20.10.8","TCP","78","","","[TCP Dup ACK 55#1] 443  >  35698 [ACK] Seq=5049 Ack=1772 Win=28672 Len=0 TSval=3403576660 TSecr=3095526669 SLE=1803 SRE=1804"
"63","3.285526078","20.189.173.14","172.20.10.8","TCP","78","","","443  >  35698 [ACK] Seq=5049 Ack=1804 Win=28672 Len=0 TSval=3403576660 TSecr=3095527079 SLE=1803 SRE=1804"
"64","3.949017286","172.20.10.8","172.20.10.1","DNS","94","53","57532","Standard query 0x10a8 A www.msftconnecttest.com OPT"
"65","3.949084945","172.20.10.8","172.20.10.1","DNS","94","53","60385","Standard query 0xb56b AAAA www.msftconnecttest.com OPT"
"66","3.963159672","172.20.10.8","172.20.10.1","DNS","121","53","35575","Standard query 0xb22b AAAA ip.azeus1-client-s.msnmessenger.msn.com.akadns.net OPT"
"67","3.967989661","172.20.10.1","172.20.10.8","DNS","187","35575","53","Standard query response 0xb22b AAAA ip.azeus1-client-s.msnmessenger.msn.com.akadns.net SOA internal.akadns.net OPT"
"68","3.969249009","172.20.10.8","20.185.212.106","TCP","74","","","55048  >  443 [SYN] Seq=0 Win=64240 Len=0 MSS=1460 SACK_PERM=1 TSval=3021128521 TSecr=0 WS=128"
"69","4.000525010","172.20.10.8","172.20.10.1","DNS","88","53","47729","Standard query 0x2091 A api.asm.skype.com OPT"
"70","4.000708789","172.20.10.8","172.20.10.1","DNS","88","53","33086","Standard query 0x9796 AAAA api.asm.skype.com OPT"
"71","4.003575034","20.185.212.106","172.20.10.8","TCP","74","","","443  >  55048 [SYN, ACK] Seq=0 Ack=1 Win=23808 Len=0 MSS=1410 SACK_PERM=1 TSval=3875124086 TSecr=3021128521 WS=512"
"72","4.003659270","172.20.10.8","20.185.212.106","TCP","66","","","55048  >  443 [ACK] Seq=1 Ack=1 Win=64256 Len=0 TSval=3021128556 TSecr=3875124086"
"73","4.004244220","172.20.10.8","20.185.212.106","TLSv1.2","583","","","Client Hello"
"74","4.011547410","172.20.10.1","172.20.10.8","DNS","230","57532","53","Standard query response 0x10a8 A www.msftconnecttest.com CNAME ncsi-geo.trafficmanager.net CNAME v4ncsi.msedge.net CNAME ncsi.4-c-0003.c-msedge.net CNAME 4-c-0003.c-msedge.net A 13.107.4.52 OPT"
"75","4.018468876","172.20.10.8","20.185.212.106","TCP","74","","","55062  >  443 [SYN] Seq=0 Win=64240 Len=0 MSS=1460 SACK_PERM=1 TSval=3021128571 TSecr=0 WS=128"
"76","4.019859599","172.20.10.8","172.20.10.1","DNS","88","53","45971","Standard query 0xfabd A api.aps.skype.com OPT"
"77","4.019937728","172.20.10.8","172.20.10.1","DNS","88","53","59716","Standard query 0xecef AAAA api.aps.skype.com OPT"
"78","4.030499276","172.20.10.1","172.20.10.8","DNS","201","47729","53","Standard query response 0x2091 A api.asm.skype.com CNAME asm-api-prod-version-skype.trafficmanager.net CNAME weu1-api-skype.cloudapp.net A 52.113.199.175 OPT"
"79","4.035801656","20.185.212.106","172.20.10.8","TCP","66","","","443  >  55048 [ACK] Seq=1 Ack=518 Win=25088 Len=0 TSval=3875124116 TSecr=3021128556"
"80","4.041815723","20.185.212.106","172.20.10.8","TCP","74","","","443  >  55062 [SYN, ACK] Seq=0 Ack=1 Win=23808 Len=0 MSS=1410 SACK_PERM=1 TSval=3875124124 TSecr=3021128571 WS=512"
"81","4.041874237","172.20.10.8","20.185.212.106","TCP","66","","","55062  >  443 [ACK] Seq=1 Ack=1 Win=64256 Len=0 TSval=3021128594 TSecr=3875124124"
"82","4.042225226","172.20.10.8","20.185.212.106","TLSv1.2","583","","","Client Hello"
"83","4.042974418","172.20.10.1","172.20.10.8","DNS","271","60385","53","Standard query response 0xb56b AAAA www.msftconnecttest.com CNAME ncsi-geo.trafficmanager.net CNAME v4ncsi.msedge.net CNAME ncsi.4-c-0003.c-msedge.net CNAME 4-c-0003.c-msedge.net SOA ns1.c-msedge.net OPT"
"84","4.043328535","172.20.10.8","172.20.10.1","DNS","92","53","50723","Standard query 0x05c8 AAAA 4-c-0003.c-msedge.net OPT"
"85","4.047166653","172.20.10.1","172.20.10.8","DNS","152","50723","53","Standard query response 0x05c8 AAAA 4-c-0003.c-msedge.net SOA ns1.c-msedge.net OPT"
"86","4.047801213","172.20.10.8","13.107.4.52","TCP","74","","","37214  >  80 [SYN] Seq=0 Win=64240 Len=0 MSS=1460 SACK_PERM=1 TSval=4052509298 TSecr=0 WS=128"
"87","4.049422312","172.20.10.1","172.20.10.8","DNS","193","45971","53","Standard query response 0xfabd A api.aps.skype.com CNAME api-aps-teams.trafficmanager.net CNAME b-aps-euwe-01-skype.cloudapp.net A 51.144.253.41 OPT"
"88","4.064688749","172.20.10.1","172.20.10.8","DNS","256","33086","53","Standard query response 0x9796 AAAA api.asm.skype.com CNAME asm-api-prod-version-skype.trafficmanager.net CNAME weu1-api-skype.cloudapp.net SOA ns1-201.azure-dns.com OPT"
"89","4.064948591","172.20.10.8","172.20.10.1","DNS","98","53","54168","Standard query 0x51a0 AAAA weu1-api-skype.cloudapp.net OPT"
"90","4.068868503","172.20.10.1","172.20.10.8","DNS","172","54168","53","Standard query response 0x51a0 AAAA weu1-api-skype.cloudapp.net SOA ns1-201.azure-dns.com OPT"
"91","4.069725297","172.20.10.8","52.113.199.175","TCP","74","","","49912  >  443 [SYN] Seq=0 Win=64240 Len=0 MSS=1460 SACK_PERM=1 TSval=2520133081 TSecr=0 WS=128"
"92","4.073452564","20.185.212.106","172.20.10.8","TCP","66","","","443  >  55062 [ACK] Seq=1 Ack=518 Win=25088 Len=0 TSval=3875124156 TSecr=3021128594"
"93","4.073493132","13.107.4.52","172.20.10.8","TCP","74","","","80  >  37214 [SYN, ACK] Seq=0 Ack=1 Win=23808 Len=0 MSS=1410 SACK_PERM=1 TSval=687497865 TSecr=4052509298 WS=512"
"94","4.073507608","172.20.10.8","13.107.4.52","TCP","66","","","37214  >  80 [ACK] Seq=1 Ack=1 Win=64256 Len=0 TSval=4052509324 TSecr=687497865"
"95","4.073673499","172.20.10.8","13.107.4.52","HTTP","477","","","GET /connecttest.txt?n=1680202658175 HTTP/1.1 "
"96","4.077115820","172.20.10.1","172.20.10.8","DNS","248","59716","53","Standard query response 0xecef AAAA api.aps.skype.com CNAME api-aps-teams.trafficmanager.net CNAME b-aps-euwe-01-skype.cloudapp.net SOA ns1-201.azure-dns.com OPT"
"97","4.077323735","172.20.10.8","172.20.10.1","DNS","103","53","47363","Standard query 0x5c92 AAAA b-aps-euwe-01-skype.cloudapp.net OPT"
"98","4.080759103","172.20.10.1","172.20.10.8","DNS","177","47363","53","Standard query response 0x5c92 AAAA b-aps-euwe-01-skype.cloudapp.net SOA ns1-201.azure-dns.com OPT"
"99","4.081033006","172.20.10.8","51.144.253.41","TCP","74","","","43324  >  443 [SYN] Seq=0 Win=64240 Len=0 MSS=1460 SACK_PERM=1 TSval=4028976765 TSecr=0 WS=128"
"100","4.088704930","172.20.10.8","172.20.10.1","DNS","96","53","58687","Standard query 0x30b8 A open-ai-connect.skype.com OPT"
"101","4.088772678","172.20.10.8","172.20.10.1","DNS","96","53","35833","Standard query 0x7c8d AAAA open-ai-connect.skype.com OPT"
"102","4.091472748","52.113.199.175","172.20.10.8","TCP","74","","","443  >  49912 [SYN, ACK] Seq=0 Ack=1 Win=23808 Len=0 MSS=1410 SACK_PERM=1 TSval=2490183794 TSecr=2520133081 WS=512"
"103","4.091508192","172.20.10.8","52.113.199.175","TCP","66","","","49912  >  443 [ACK] Seq=1 Ack=1 Win=64256 Len=0 TSval=2520133103 TSecr=2490183794"
"104","4.091736496","172.20.10.8","52.113.199.175","TLSv1.2","583","","","Client Hello"
"105","4.095637292","172.20.10.8","20.185.212.106","TCP","74","","","55078  >  443 [SYN] Seq=0 Win=64240 Len=0 MSS=1460 SACK_PERM=1 TSval=3021128648 TSecr=0 WS=128"
"106","4.098036124","172.20.10.8","20.185.212.106","TCP","74","","","55092  >  443 [SYN] Seq=0 Win=64240 Len=0 MSS=1460 SACK_PERM=1 TSval=3021128650 TSecr=0 WS=128"
"107","4.103377173","13.107.4.52","172.20.10.8","TCP","66","","","80  >  37214 [ACK] Seq=1 Ack=412 Win=25088 Len=0 TSval=687497895 TSecr=4052509324"
"108","4.107716148","51.144.253.41","172.20.10.8","TCP","74","","","443  >  43324 [SYN, ACK] Seq=0 Ack=1 Win=23808 Len=0 MSS=1410 SACK_PERM=1 TSval=4178955449 TSecr=4028976765 WS=512"
"109","4.107733589","172.20.10.8","51.144.253.41","TCP","66","","","43324  >  443 [ACK] Seq=1 Ack=1 Win=64256 Len=0 TSval=4028976792 TSecr=4178955449"
"110","4.107877593","172.20.10.8","51.144.253.41","TLSv1.2","583","","","Client Hello"
"111","4.113878145","13.107.4.52","172.20.10.8","HTTP","586","","","HTTP/1.1 200 OK  (text/plain)"
"112","4.113894028","172.20.10.8","13.107.4.52","TCP","66","","","37214  >  80 [ACK] Seq=412 Ack=521 Win=63744 Len=0 TSval=4052509364 TSecr=687497901"
"113","4.119335109","20.185.212.106","172.20.10.8","TCP","74","","","443  >  55078 [SYN, ACK] Seq=0 Ack=1 Win=23808 Len=0 MSS=1410 SACK_PERM=1 TSval=3875124199 TSecr=3021128648 WS=512"
"114","4.119417883","172.20.10.8","20.185.212.106","TCP","66","","","55078  >  443 [ACK] Seq=1 Ack=1 Win=64256 Len=0 TSval=3021128672 TSecr=3875124199"
"115","4.119913322","172.20.10.8","20.185.212.106","TLSv1.2","583","","","Client Hello"
"116","4.124241554","52.113.199.175","172.20.10.8","TCP","66","","","443  >  49912 [ACK] Seq=1 Ack=518 Win=25088 Len=0 TSval=2490183823 TSecr=2520133103"
"117","4.132771057","52.113.199.175","172.20.10.8","TCP","1464","","","443  >  49912 [ACK] Seq=1 Ack=518 Win=25088 Len=1398 TSval=2490183833 TSecr=2520133103 [TCP segment of a reassembled PDU]"
"118","4.132785753","172.20.10.8","52.113.199.175","TCP","66","","","49912  >  443 [ACK] Seq=518 Ack=1399 Win=63104 Len=0 TSval=2520133144 TSecr=2490183833"
"119","4.137342575","52.113.199.175","172.20.10.8","TCP","1464","","","443  >  49912 [PSH, ACK] Seq=1399 Ack=518 Win=25088 Len=1398 TSval=2490183833 TSecr=2520133103 [TCP segment of a reassembled PDU]"
"120","4.137359651","172.20.10.8","52.113.199.175","TCP","66","","","49912  >  443 [ACK] Seq=518 Ack=2797 Win=63104 Len=0 TSval=2520133149 TSecr=2490183833"
"121","4.137342675","52.113.199.175","172.20.10.8","TCP","1500","","","443  >  49912 [PSH, ACK] Seq=2797 Ack=518 Win=25088 Len=1434 TSval=2490183833 TSecr=2520133103 [TCP segment of a reassembled PDU]"
"122","4.137401015","172.20.10.8","52.113.199.175","TCP","66","","","49912  >  443 [ACK] Seq=518 Ack=4231 Win=61696 Len=0 TSval=2520133149 TSecr=2490183833"
"123","4.141855015","52.113.199.175","172.20.10.8","TLSv1.2","1494","","","Server Hello, Certificate, Certificate Status, Server Key Exchange, Server Hello Done"
"124","4.141853506","20.185.212.106","172.20.10.8","TCP","74","","","443  >  55092 [SYN, ACK] Seq=0 Ack=1 Win=23808 Len=0 MSS=1410 SACK_PERM=1 TSval=3875124215 TSecr=3021128650 WS=512"
"125","4.141881823","172.20.10.8","52.113.199.175","TCP","66","","","49912  >  443 [ACK] Seq=518 Ack=5659 Win=62720 Len=0 TSval=2520133153 TSecr=2490183833"
"126","4.141907089","172.20.10.8","20.185.212.106","TCP","66","","","55092  >  443 [ACK] Seq=1 Ack=1 Win=64256 Len=0 TSval=3021128694 TSecr=3875124215"
"127","4.142169069","172.20.10.8","20.185.212.106","TLSv1.2","583","","","Client Hello"
"128","4.143776455","51.144.253.41","172.20.10.8","TCP","66","","","443  >  43324 [ACK] Seq=1 Ack=518 Win=25088 Len=0 TSval=4178955483 TSecr=4028976792"
"129","4.145723904","172.20.10.1","172.20.10.8","DNS","197","35833","53","Standard query response 0x7c8d AAAA open-ai-connect.skype.com CNAME open-ai-connect-skype-com.s-0006.s-msedge.net CNAME s-0006.s-msedge.net AAAA 2620:1ec:42::133 OPT"
"130","4.145724628","172.20.10.1","172.20.10.8","DNS","185","58687","53","Standard query response 0x30b8 A open-ai-connect.skype.com CNAME open-ai-connect-skype-com.s-0006.s-msedge.net CNAME s-0006.s-msedge.net A 52.113.194.133 OPT"
"131","4.146793904","172.20.10.8","52.113.199.175","TLSv1.2","224","","","Client Key Exchange, Change Cipher Spec, Encrypted Handshake Message"
"132","4.146867606","2a02:a020:41:bfaa:c2f5:1c59:a110:d980","2620:1ec:42::133","TCP","94","","","42634  >  443 [SYN] Seq=0 Win=65330 Len=0 MSS=1390 SACK_PERM=1 TSval=3492931988 TSecr=0 WS=128"
"133","4.148135310","51.144.253.41","172.20.10.8","TCP","1464","","","443  >  43324 [ACK] Seq=1 Ack=518 Win=25088 Len=1398 TSval=4178955491 TSecr=4028976792 [TCP segment of a reassembled PDU]"
"134","4.148143014","172.20.10.8","51.144.253.41","TCP","66","","","43324  >  443 [ACK] Seq=518 Ack=1399 Win=63104 Len=0 TSval=4028976832 TSecr=4178955491"
"135","4.152876451","51.144.253.41","172.20.10.8","TCP","1464","","","443  >  43324 [PSH, ACK] Seq=1399 Ack=518 Win=25088 Len=1398 TSval=4178955491 TSecr=4028976792 [TCP segment of a reassembled PDU]"
"136","4.152895203","172.20.10.8","51.144.253.41","TCP","66","","","43324  >  443 [ACK] Seq=518 Ack=2797 Win=63104 Len=0 TSval=4028976837 TSecr=4178955491"
"137","4.152876638","51.144.253.41","172.20.10.8","TCP","90","","","443  >  43324 [PSH, ACK] Seq=2797 Ack=518 Win=25088 Len=24 TSval=4178955491 TSecr=4028976792 [TCP segment of a reassembled PDU]"
"138","4.152912487","172.20.10.8","51.144.253.41","TCP","66","","","43324  >  443 [ACK] Seq=518 Ack=2821 Win=63104 Len=0 TSval=4028976837 TSecr=4178955491"
"139","4.152876681","51.144.253.41","172.20.10.8","TCP","1464","","","443  >  43324 [ACK] Seq=2821 Ack=518 Win=25088 Len=1398 TSval=4178955491 TSecr=4028976792 [TCP segment of a reassembled PDU]"
"140","4.152917502","172.20.10.8","51.144.253.41","TCP","66","","","43324  >  443 [ACK] Seq=518 Ack=4219 Win=61824 Len=0 TSval=4028976837 TSecr=4178955491"
"141","4.156139723","51.144.253.41","172.20.10.8","TCP","1464","","","443  >  43324 [PSH, ACK] Seq=4219 Ack=518 Win=25088 Len=1398 TSval=4178955491 TSecr=4028976792 [TCP segment of a reassembled PDU]"
"142","4.156149151","172.20.10.8","51.144.253.41","TCP","66","","","43324  >  443 [ACK] Seq=518 Ack=5617 Win=63104 Len=0 TSval=4028976840 TSecr=4178955491"
"143","4.156149958","20.185.212.106","172.20.10.8","TCP","66","","","443  >  55078 [ACK] Seq=1 Ack=518 Win=25088 Len=0 TSval=3875124230 TSecr=3021128672"
"144","4.156139847","51.144.253.41","172.20.10.8","TLSv1.2","117","","","Server Hello, Certificate, Certificate Status, Server Key Exchange, Server Hello Done"
"145","4.156162431","172.20.10.8","51.144.253.41","TCP","66","","","43324  >  443 [ACK] Seq=518 Ack=5668 Win=63104 Len=0 TSval=4028976840 TSecr=4178955491"
"146","4.158584799","172.20.10.8","51.144.253.41","TLSv1.2","224","","","Client Key Exchange, Change Cipher Spec, Encrypted Handshake Message"
"147","4.158867990","172.20.10.8","51.144.253.41","TLSv1.2","1334","","","Application Data, Application Data"
"148","4.159039157","172.20.10.8","51.144.253.41","TLSv1.2","323","","","Application Data, Application Data"
"149","4.170679605","20.185.212.106","172.20.10.8","TCP","66","","","443  >  55092 [ACK] Seq=1 Ack=518 Win=25088 Len=0 TSval=3875124253 TSecr=3021128694"
"150","4.179472834","52.113.199.175","172.20.10.8","TLSv1.2","117","","","Change Cipher Spec, Encrypted Handshake Message"
"151","4.179472576","2620:1ec:42::133","2a02:a020:41:bfaa:c2f5:1c59:a110:d980","TCP","86","","","443  >  42634 [SYN, ACK] Seq=0 Ack=1 Win=65535 Len=0 MSS=1400 WS=256 SACK_PERM=1"
"152","4.179493003","2a02:a020:41:bfaa:c2f5:1c59:a110:d980","2620:1ec:42::133","TCP","74","","","42634  >  443 [ACK] Seq=1 Ack=1 Win=65408 Len=0"
"153","4.179738139","2a02:a020:41:bfaa:c2f5:1c59:a110:d980","2620:1ec:42::133","TLSv1.2","591","","","Client Hello"
"154","4.179854034","172.20.10.8","52.113.199.175","TLSv1.2","2157","","","Application Data"
"155","4.180614341","172.20.10.8","52.113.199.175","TLSv1.2","744","","","Application Data"
"156","4.194351572","51.144.253.41","172.20.10.8","TLSv1.2","186","","","Change Cipher Spec, Encrypted Handshake Message, Application Data"
"157","4.194497017","172.20.10.8","51.144.253.41","TLSv1.2","104","","","Application Data"
"158","4.202414035","20.185.212.106","172.20.10.8","TCP","2862","","","443  >  55048 [PSH, ACK] Seq=1 Ack=518 Win=25088 Len=2796 TSval=3875124281 TSecr=3021128556 [TCP segment of a reassembled PDU]"
"159","4.202478166","172.20.10.8","20.185.212.106","TCP","66","","","55048  >  443 [ACK] Seq=518 Ack=2797 Win=61568 Len=0 TSval=3021128755 TSecr=3875124281"
"160","4.208593554","20.185.212.106","172.20.10.8","TCP","1464","","","443  >  55048 [ACK] Seq=2797 Ack=518 Win=25088 Len=1398 TSval=3875124281 TSecr=3021128556 [TCP segment of a reassembled PDU]"
"161","4.208607188","172.20.10.8","20.185.212.106","TCP","66","","","55048  >  443 [ACK] Seq=518 Ack=4195 Win=63104 Len=0 TSval=3021128761 TSecr=3875124281"
"162","4.214064454","20.185.212.106","172.20.10.8","TCP","1464","","","443  >  55048 [PSH, ACK] Seq=4195 Ack=518 Win=25088 Len=1398 TSval=3875124281 TSecr=3021128556 [TCP segment of a reassembled PDU]"
"163","4.214076711","172.20.10.8","20.185.212.106","TCP","66","","","55048  >  443 [ACK] Seq=518 Ack=5593 Win=63104 Len=0 TSval=3021128766 TSecr=3875124281"
"164","4.214064642","20.185.212.106","172.20.10.8","TLSv1.2","552","","","Server Hello, Certificate, Certificate Status, Server Key Exchange, Server Hello Done"
"165","4.214091715","172.20.10.8","20.185.212.106","TCP","66","","","55048  >  443 [ACK] Seq=518 Ack=6079 Win=62720 Len=0 TSval=3021128766 TSecr=3875124281"
"166","4.214495231","51.144.253.41","172.20.10.8","TCP","66","","","443  >  43324 [ACK] Seq=5788 Ack=2201 Win=31232 Len=0 TSval=4178955546 TSecr=4028976843"
"167","4.214495299","51.144.253.41","172.20.10.8","TLSv1.2","104","","","Application Data"
"168","4.214495335","51.144.253.41","172.20.10.8","TLSv1.2","262","","","Application Data"
"169","4.214495359","51.144.253.41","172.20.10.8","TLSv1.2","259","","","Application Data, Application Data"
"170","4.214557293","172.20.10.8","51.144.253.41","TCP","66","","","43324  >  443 [ACK] Seq=2239 Ack=6215 Win=64128 Len=0 TSval=4028976899 TSecr=4178955553"
"171","4.218770308","172.20.10.8","20.185.212.106","TLSv1.2","224","","","Client Key Exchange, Change Cipher Spec, Encrypted Handshake Message"
"172","4.219094872","172.20.10.8","51.144.253.41","TLSv1.2","108","","","Application Data"
"173","4.221803364","52.113.199.175","172.20.10.8","TCP","66","","","443  >  49912 [ACK] Seq=5710 Ack=2767 Win=31744 Len=0 TSval=2490183921 TSecr=2520133191"
"174","4.221805386","2620:1ec:42::133","2a02:a020:41:bfaa:c2f5:1c59:a110:d980","TCP","86","","","443  >  42634 [ACK] Seq=1 Ack=518 Win=25088 Len=0 TSval=37 TSecr=3492931988"
"175","4.223968108","172.20.10.8","172.20.10.1","DNS","88","53","43703","Standard query 0x65cd A options.skype.com OPT"
"176","4.224051236","172.20.10.8","172.20.10.1","DNS","88","53","56901","Standard query 0x08b6 AAAA options.skype.com OPT"
"177","4.227612515","52.113.199.175","172.20.10.8","TLSv1.2","1383","","","Application Data"
"178","4.232673647","2620:1ec:42::133","2a02:a020:41:bfaa:c2f5:1c59:a110:d980","TCP","2842","","","443  >  42634 [PSH, ACK] Seq=1 Ack=518 Win=25088 Len=2756 TSval=49 TSecr=3492931988 [TCP segment of a reassembled PDU]"
"179","4.232673974","2620:1ec:42::133","2a02:a020:41:bfaa:c2f5:1c59:a110:d980","TCP","1464","","","443  >  42634 [ACK] Seq=2757 Ack=518 Win=25088 Len=1378 TSval=49 TSecr=3492931988 [TCP segment of a reassembled PDU]"
"180","4.232711086","2a02:a020:41:bfaa:c2f5:1c59:a110:d980","2620:1ec:42::133","TCP","74","","","42634  >  443 [ACK] Seq=518 Ack=2757 Win=62720 Len=0"
"181","4.232750976","2a02:a020:41:bfaa:c2f5:1c59:a110:d980","2620:1ec:42::133","TCP","74","","","42634  >  443 [ACK] Seq=518 Ack=4135 Win=61440 Len=0"
"182","4.236790382","2620:1ec:42::133","2a02:a020:41:bfaa:c2f5:1c59:a110:d980","TCP","1464","","","443  >  42634 [PSH, ACK] Seq=4135 Ack=518 Win=25088 Len=1378 TSval=49 TSecr=3492931988 [TCP segment of a reassembled PDU]"
"183","4.236790670","2620:1ec:42::133","2a02:a020:41:bfaa:c2f5:1c59:a110:d980","TCP","134","","","443  >  42634 [PSH, ACK] Seq=5513 Ack=518 Win=25088 Len=48 TSval=49 TSecr=3492931988 [TCP segment of a reassembled PDU]"
"184","4.236790701","2620:1ec:42::133","2a02:a020:41:bfaa:c2f5:1c59:a110:d980","TLSv1.2","485","","","Server Hello, Certificate, Certificate Status, Server Key Exchange, Server Hello Done"
"185","4.236821407","2a02:a020:41:bfaa:c2f5:1c59:a110:d980","2620:1ec:42::133","TCP","74","","","42634  >  443 [ACK] Seq=518 Ack=5513 Win=63104 Len=0"
"186","4.236845909","2a02:a020:41:bfaa:c2f5:1c59:a110:d980","2620:1ec:42::133","TCP","74","","","42634  >  443 [ACK] Seq=518 Ack=5561 Win=63104 Len=0"
"187","4.236849197","2a02:a020:41:bfaa:c2f5:1c59:a110:d980","2620:1ec:42::133","TCP","74","","","42634  >  443 [ACK] Seq=518 Ack=5960 Win=62720 Len=0"
"188","4.240224324","2a02:a020:41:bfaa:c2f5:1c59:a110:d980","2620:1ec:42::133","TLSv1.2","232","","","Client Key Exchange, Change Cipher Spec, Encrypted Handshake Message"
"189","4.240411811","2a02:a020:41:bfaa:c2f5:1c59:a110:d980","2620:1ec:42::133","TLSv1.2","1370","","","Application Data, Application Data"
"190","4.242026060","20.185.212.106","172.20.10.8","TCP","2862","","","443  >  55062 [PSH, ACK] Seq=1 Ack=518 Win=25088 Len=2796 TSval=3875124320 TSecr=3021128594 [TCP segment of a reassembled PDU]"
"191","4.242040424","172.20.10.8","20.185.212.106","TCP","66","","","55062  >  443 [ACK] Seq=518 Ack=2797 Win=61568 Len=0 TSval=3021128794 TSecr=3875124320"
"192","4.248670601","20.185.212.106","172.20.10.8","TCP","1464","","","443  >  55062 [ACK] Seq=2797 Ack=518 Win=25088 Len=1398 TSval=3875124320 TSecr=3021128594 [TCP segment of a reassembled PDU]"
"193","4.248681467","172.20.10.8","20.185.212.106","TCP","66","","","55062  >  443 [ACK] Seq=518 Ack=4195 Win=63104 Len=0 TSval=3021128801 TSecr=3875124320"
"194","4.254332394","51.144.253.41","172.20.10.8","TCP","66","","","443  >  43324 [ACK] Seq=6215 Ack=2281 Win=31232 Len=0 TSval=4178955590 TSecr=4028976879"
"195","4.254332866","20.185.212.106","172.20.10.8","TCP","66","","","443  >  55048 [ACK] Seq=6079 Ack=676 Win=26112 Len=0 TSval=3875124328 TSecr=3021128771"
"196","4.254333974","20.185.212.106","172.20.10.8","TCP","1464","","","443  >  55062 [PSH, ACK] Seq=4195 Ack=518 Win=25088 Len=1398 TSval=3875124320 TSecr=3021128594 [TCP segment of a reassembled PDU]"
"197","4.254412533","172.20.10.8","20.185.212.106","TCP","66","","","55062  >  443 [ACK] Seq=518 Ack=5593 Win=63104 Len=0 TSval=3021128807 TSecr=3875124320"
"198","4.254334017","20.185.212.106","172.20.10.8","TCP","114","","","443  >  55062 [PSH, ACK] Seq=5593 Ack=518 Win=25088 Len=48 TSval=3875124320 TSecr=3021128594 [TCP segment of a reassembled PDU]"
"199","4.254485152","172.20.10.8","20.185.212.106","TCP","66","","","55062  >  443 [ACK] Seq=518 Ack=5641 Win=63104 Len=0 TSval=3021128807 TSecr=3875124320"
"200","4.254334048","20.185.212.106","172.20.10.8","TLSv1.2","504","","","Server Hello, Certificate, Certificate Status, Server Key Exchange, Server Hello Done"
"201","4.254496311","172.20.10.8","20.185.212.106","TCP","66","","","55062  >  443 [ACK] Seq=518 Ack=6079 Win=62720 Len=0 TSval=3021128807 TSecr=3875124320"
"202","4.257840884","172.20.10.8","20.185.212.106","TLSv1.2","224","","","Client Key Exchange, Change Cipher Spec, Encrypted Handshake Message"
"203","4.258703780","172.20.10.1","172.20.10.8","DNS","211","43703","53","Standard query response 0x65cd A options.skype.com CNAME skype-options-prod.trafficmanager.net CNAME optionsservice-prod-westeurope-b.cloudapp.net A 51.137.91.111 OPT"
"204","4.268478773","172.20.10.8","52.113.199.175","TCP","66","","","49912  >  443 [ACK] Seq=3445 Ack=7027 Win=64128 Len=0 TSval=2520133280 TSecr=2490183930"
"205","4.276200005","2620:1ec:42::133","2a02:a020:41:bfaa:c2f5:1c59:a110:d980","TCP","86","","","443  >  42634 [ACK] Seq=5960 Ack=1972 Win=28672 Len=0 TSval=96 TSecr=3492931988"
"206","4.276200175","2620:1ec:42::133","2a02:a020:41:bfaa:c2f5:1c59:a110:d980","TLSv1.2","497","","","New Session Ticket, Change Cipher Spec, Encrypted Handshake Message, Application Data"
"207","4.276343726","2a02:a020:41:bfaa:c2f5:1c59:a110:d980","2620:1ec:42::133","TLSv1.2","112","","","Application Data"
"208","4.283806157","172.20.10.1","172.20.10.8","DNS","266","56901","53","Standard query response 0x08b6 AAAA options.skype.com CNAME skype-options-prod.trafficmanager.net CNAME optionsservice-prod-westeurope-b.cloudapp.net SOA ns1-201.azure-dns.com OPT"
"209","4.284064826","172.20.10.8","172.20.10.1","DNS","116","53","48265","Standard query 0x0a71 AAAA optionsservice-prod-westeurope-b.cloudapp.net OPT"
"210","4.287096947","2620:1ec:42::133","2a02:a020:41:bfaa:c2f5:1c59:a110:d980","TLSv1.2","124","","","Application Data"
"211","4.287877393","172.20.10.1","172.20.10.8","DNS","190","48265","53","Standard query response 0x0a71 AAAA optionsservice-prod-westeurope-b.cloudapp.net SOA ns1-201.azure-dns.com OPT"
"212","4.288439215","172.20.10.8","51.137.91.111","TCP","74","","","36098  >  443 [SYN] Seq=0 Win=64240 Len=0 MSS=1460 SACK_PERM=1 TSval=331472659 TSecr=0 WS=128"
"213","4.291250501","20.185.212.106","172.20.10.8","TCP","66","","","443  >  55062 [ACK] Seq=6079 Ack=676 Win=26112 Len=0 TSval=3875124373 TSecr=3021128810"
"214","4.321150204","20.185.212.106","172.20.10.8","TCP","1464","","","443  >  55078 [ACK] Seq=1 Ack=518 Win=25088 Len=1398 TSval=3875124395 TSecr=3021128672 [TCP segment of a reassembled PDU]"
"215","4.321311704","172.20.10.8","20.185.212.106","TCP","66","","","55078  >  443 [ACK] Seq=518 Ack=1399 Win=63104 Len=0 TSval=3021128873 TSecr=3875124395"
"216","4.326897885","51.137.91.111","172.20.10.8","TCP","74","","","443  >  36098 [SYN, ACK] Seq=0 Ack=1 Win=23808 Len=0 MSS=1410 SACK_PERM=1 TSval=1480248437 TSecr=331472659 WS=512"
"217","4.326903122","20.185.212.106","172.20.10.8","TCP","1464","","","443  >  55078 [PSH, ACK] Seq=1399 Ack=518 Win=25088 Len=1398 TSval=3875124395 TSecr=3021128672 [TCP segment of a reassembled PDU]"
"218","4.326912792","172.20.10.8","20.185.212.106","TCP","66","","","55078  >  443 [ACK] Seq=518 Ack=2797 Win=63104 Len=0 TSval=3021128879 TSecr=3875124395"
"219","4.326923182","172.20.10.8","51.137.91.111","TCP","66","","","36098  >  443 [ACK] Seq=1 Ack=1 Win=64256 Len=0 TSval=331472697 TSecr=1480248437"
"220","4.326903159","20.185.212.106","172.20.10.8","TCP","1500","","","443  >  55078 [PSH, ACK] Seq=2797 Ack=518 Win=25088 Len=1434 TSval=3875124395 TSecr=3021128672 [TCP segment of a reassembled PDU]"
"221","4.326929143","172.20.10.8","20.185.212.106","TCP","66","","","55078  >  443 [ACK] Seq=518 Ack=4231 Win=61696 Len=0 TSval=3021128879 TSecr=3875124395"
"222","4.326903188","20.185.212.106","172.20.10.8","TLSv1.2","1914","","","Server Hello, Certificate, Certificate Status, Server Key Exchange, Server Hello Done"
"223","4.326934115","172.20.10.8","20.185.212.106","TCP","66","","","55078  >  443 [ACK] Seq=518 Ack=6079 Win=59904 Len=0 TSval=3021128879 TSecr=3875124395"
"224","4.327085251","172.20.10.8","51.137.91.111","TLSv1.2","583","","","Client Hello"
"225","4.328175046","172.20.10.8","20.185.212.106","TLSv1.2","224","","","Client Key Exchange, Change Cipher Spec, Encrypted Handshake Message"
"226","4.332472230","2a02:a020:41:bfaa:c2f5:1c59:a110:d980","2620:1ec:42::133","TCP","74","","","42634  >  443 [ACK] Seq=2010 Ack=6409 Win=64256 Len=0"
"227","4.332514261","20.185.212.106","172.20.10.8","TLSv1.2","117","","","Change Cipher Spec, Encrypted Handshake Message"
"228","4.332687213","172.20.10.8","20.185.212.106","TLSv1.2","3774","","","Application Data"
"229","4.333503338","172.20.10.8","20.185.212.106","TLSv1.2","121","","","Application Data"
"230","4.338482903","20.185.212.106","172.20.10.8","TCP","2862","","","443  >  55092 [PSH, ACK] Seq=1 Ack=518 Win=25088 Len=2796 TSval=3875124419 TSecr=3021128694 [TCP segment of a reassembled PDU]"
"231","4.338481808","2620:1ec:42::133","2a02:a020:41:bfaa:c2f5:1c59:a110:d980","TCP","86","","","443  >  42634 [ACK] Seq=6409 Ack=2010 Win=28672 Len=0 TSval=156 TSecr=3492931988"
"232","4.338631644","172.20.10.8","20.185.212.106","TCP","66","","","55092  >  443 [ACK] Seq=518 Ack=2797 Win=61568 Len=0 TSval=3021128891 TSecr=3875124419"
"233","4.338775258","20.185.212.106","172.20.10.8","TCP","1464","","","443  >  55092 [ACK] Seq=2797 Ack=518 Win=25088 Len=1398 TSval=3875124419 TSecr=3021128694 [TCP segment of a reassembled PDU]"
"234","4.338794087","172.20.10.8","20.185.212.106","TCP","66","","","55092  >  443 [ACK] Seq=518 Ack=4195 Win=63104 Len=0 TSval=3021128891 TSecr=3875124419"
"235","4.342792518","20.185.212.106","172.20.10.8","TCP","1464","","","443  >  55092 [PSH, ACK] Seq=4195 Ack=518 Win=25088 Len=1398 TSval=3875124419 TSecr=3021128694 [TCP segment of a reassembled PDU]"
"236","4.342799211","172.20.10.8","20.185.212.106","TCP","66","","","55092  >  443 [ACK] Seq=518 Ack=5593 Win=63104 Len=0 TSval=3021128895 TSecr=3875124419"
"237","4.342792621","20.185.212.106","172.20.10.8","TLSv1.2","552","","","Server Hello, Certificate, Certificate Status, Server Key Exchange, Server Hello Done"
"238","4.342808615","172.20.10.8","20.185.212.106","TCP","66","","","55092  >  443 [ACK] Seq=518 Ack=6079 Win=62720 Len=0 TSval=3021128895 TSecr=3875124419"
"239","4.344105064","172.20.10.8","20.185.212.106","TLSv1.2","224","","","Client Key Exchange, Change Cipher Spec, Encrypted Handshake Message"
"240","4.367501464","51.137.91.111","172.20.10.8","TCP","66","","","443  >  36098 [ACK] Seq=1 Ack=518 Win=25088 Len=0 TSval=1480248492 TSecr=331472697"
"241","4.367501484","20.185.212.106","172.20.10.8","TCP","66","","","443  >  55078 [ACK] Seq=6079 Ack=676 Win=26112 Len=0 TSval=3875124450 TSecr=3021128880"
"242","4.378025600","51.137.91.111","172.20.10.8","TCP","1464","","","443  >  36098 [ACK] Seq=1 Ack=518 Win=25088 Len=1398 TSval=1480248500 TSecr=331472697 [TCP segment of a reassembled PDU]"
"243","4.378058219","172.20.10.8","51.137.91.111","TCP","66","","","36098  >  443 [ACK] Seq=518 Ack=1399 Win=63104 Len=0 TSval=331472748 TSecr=1480248500"
"244","4.384743287","51.137.91.111","172.20.10.8","TCP","1464","","","443  >  36098 [PSH, ACK] Seq=1399 Ack=518 Win=25088 Len=1398 TSval=1480248500 TSecr=331472697 [TCP segment of a reassembled PDU]"
"245","4.384758402","172.20.10.8","51.137.91.111","TCP","66","","","36098  >  443 [ACK] Seq=518 Ack=2797 Win=63104 Len=0 TSval=331472755 TSecr=1480248500"
"246","4.387026301","20.185.212.106","172.20.10.8","TCP","66","","","443  >  55092 [ACK] Seq=6079 Ack=676 Win=26112 Len=0 TSval=3875124462 TSecr=3021128896"
"247","4.387053226","20.185.212.106","172.20.10.8","TLSv1.2","117","","","Change Cipher Spec, Encrypted Handshake Message"
"248","4.387073856","51.137.91.111","172.20.10.8","TCP","90","","","443  >  36098 [PSH, ACK] Seq=2797 Ack=518 Win=25088 Len=24 TSval=1480248500 TSecr=331472697 [TCP segment of a reassembled PDU]"
"249","4.387103985","172.20.10.8","51.137.91.111","TCP","66","","","36098  >  443 [ACK] Seq=518 Ack=2821 Win=64128 Len=0 TSval=331472757 TSecr=1480248500"
"250","4.387073891","51.137.91.111","172.20.10.8","TCP","2862","","","443  >  36098 [PSH, ACK] Seq=2821 Ack=518 Win=25088 Len=2796 TSval=1480248501 TSecr=331472697 [TCP segment of a reassembled PDU]"
"251","4.387147369","172.20.10.8","51.137.91.111","TCP","66","","","36098  >  443 [ACK] Seq=518 Ack=5617 Win=61440 Len=0 TSval=331472757 TSecr=1480248501"
"252","4.387073920","51.137.91.111","172.20.10.8","TCP","90","","","443  >  36098 [PSH, ACK] Seq=5617 Ack=518 Win=25088 Len=24 TSval=1480248501 TSecr=331472697 [TCP segment of a reassembled PDU]"
"253","4.387151850","172.20.10.8","51.137.91.111","TCP","66","","","36098  >  443 [ACK] Seq=518 Ack=5641 Win=61440 Len=0 TSval=331472757 TSecr=1480248501"
"254","4.387073945","51.137.91.111","172.20.10.8","TLSv1.2","1048","","","Server Hello, Certificate, Certificate Status, Server Key Exchange, Server Hello Done"
"255","4.387157557","172.20.10.8","51.137.91.111","TCP","66","","","36098  >  443 [ACK] Seq=518 Ack=6623 Win=60544 Len=0 TSval=331472757 TSecr=1480248501"
"256","4.387073968","20.185.212.106","172.20.10.8","TCP","66","","","443  >  55048 [ACK] Seq=6130 Ack=2074 Win=29184 Len=0 TSval=3875124460 TSecr=3021128885"
"257","4.387430967","20.185.212.106","172.20.10.8","TCP","66","","","443  >  55048 [ACK] Seq=6130 Ack=3472 Win=31744 Len=0 TSval=3875124462 TSecr=3021128885"
"258","4.387431027","20.185.212.106","172.20.10.8","TCP","66","","","443  >  55048 [ACK] Seq=6130 Ack=4384 Win=34816 Len=0 TSval=3875124462 TSecr=3021128885"
"259","4.387431059","20.185.212.106","172.20.10.8","TCP","66","","","443  >  55048 [ACK] Seq=6130 Ack=4439 Win=34816 Len=0 TSval=3875124462 TSecr=3021128886"
"260","4.387963268","172.20.10.8","20.185.212.106","TLSv1.2","1631","","","Application Data"
"261","4.391559673","172.20.10.8","51.137.91.111","TLSv1.2","224","","","Client Key Exchange, Change Cipher Spec, Encrypted Handshake Message"
"262","4.427661288","20.185.212.106","172.20.10.8","TCP","66","","","443  >  55062 [ACK] Seq=6130 Ack=2074 Win=29184 Len=0 TSval=3875124509 TSecr=3021128940"
"263","4.427661645","20.185.212.106","172.20.10.8","TCP","66","","","443  >  55062 [ACK] Seq=6130 Ack=2241 Win=31744 Len=0 TSval=3875124509 TSecr=3021128940"
"264","4.437796937","51.137.91.111","172.20.10.8","TLSv1.2","117","","","Change Cipher Spec, Encrypted Handshake Message"
"265","4.438714058","172.20.10.8","51.137.91.111","TLSv1.2","1460","","","Application Data"
"266","4.443773321","2620:1ec:42::133","2a02:a020:41:bfaa:c2f5:1c59:a110:d980","TLSv1.2","372","","","Application Data, Application Data"
"267","4.443808667","2a02:a020:41:bfaa:c2f5:1c59:a110:d980","2620:1ec:42::133","TCP","74","","","42634  >  443 [ACK] Seq=2010 Ack=6695 Win=64000 Len=0"
"268","4.454522434","20.185.212.106","172.20.10.8","TLSv1.2","117","","","Change Cipher Spec, Encrypted Handshake Message"
"269","4.454876214","172.20.10.8","20.185.212.106","TLSv1.2","1722","","","Application Data"
"270","4.456512221","172.20.10.8","20.185.212.106","TLSv1.2","277","","","Application Data"
"271","4.469381487","172.20.10.8","172.20.10.1","DNS","100","53","60278","Standard query 0x87b0 AAAA connectivity-check.ubuntu.com OPT"
"272","4.474447022","20.185.212.106","172.20.10.8","TLSv1.2","117","","","Change Cipher Spec, Encrypted Handshake Message"
"273","4.474662532","172.20.10.8","20.185.212.106","TLSv1.2","1954","","","Application Data"
"274","4.479790329","20.185.212.106","172.20.10.8","TLSv1.2","333","","","Application Data"
"275","4.486604532","20.185.212.106","172.20.10.8","TCP","66","","","443  >  55078 [ACK] Seq=6130 Ack=2074 Win=29184 Len=0 TSval=3875124569 TSecr=3021129007"
"276","4.491995404","20.185.212.106","172.20.10.8","TCP","66","","","443  >  55078 [ACK] Seq=6130 Ack=2332 Win=31744 Len=0 TSval=3875124569 TSecr=3021129007"
"277","4.491994948","51.137.91.111","172.20.10.8","TLSv1.2","578","","","Application Data, Application Data"
"278","4.491995439","20.185.212.106","172.20.10.8","TCP","66","","","443  >  55078 [ACK] Seq=6130 Ack=2543 Win=34816 Len=0 TSval=3875124570 TSecr=3021129009"
"279","4.499430957","172.20.10.1","172.20.10.8","DNS","268","60278","53","Standard query response 0x87b0 AAAA connectivity-check.ubuntu.com AAAA 2620:2d:4000:1::2a AAAA 2620:2d:4000:1::22 AAAA 2620:2d:4000:1::2b AAAA 2001:67c:1562::23 AAAA 2001:67c:1562::24 AAAA 2620:2d:4000:1::23 OPT"
"280","4.500368928","2a02:a020:41:bfaa:c2f5:1c59:a110:d980","2620:2d:4000:1::2a","TCP","94","","","47364  >  80 [SYN] Seq=0 Win=65330 Len=0 MSS=1390 SACK_PERM=1 TSval=2692370483 TSecr=0 WS=128"
"281","4.507524298","20.185.212.106","172.20.10.8","TCP","66","","","443  >  55092 [ACK] Seq=6130 Ack=2074 Win=29184 Len=0 TSval=3875124590 TSecr=3021129027"
"282","4.507524983","20.185.212.106","172.20.10.8","TCP","66","","","443  >  55092 [ACK] Seq=6130 Ack=2564 Win=31744 Len=0 TSval=3875124590 TSecr=3021129027"
"283","4.520524474","172.20.10.8","20.185.212.106","TCP","66","","","55048  >  443 [ACK] Seq=4439 Ack=6397 Win=64128 Len=0 TSval=3021129073 TSecr=3875124553"
"284","4.531266475","2620:2d:4000:1::2a","2a02:a020:41:bfaa:c2f5:1c59:a110:d980","TCP","94","","","80  >  47364 [SYN, ACK] Seq=0 Ack=1 Win=64260 Len=0 MSS=1410 SACK_PERM=1 TSval=1667952589 TSecr=2692370483 WS=128"
"285","4.531289528","2a02:a020:41:bfaa:c2f5:1c59:a110:d980","2620:2d:4000:1::2a","TCP","86","","","47364  >  80 [ACK] Seq=1 Ack=1 Win=65408 Len=0 TSval=2692370513 TSecr=1667952589"
"286","4.531361232","2a02:a020:41:bfaa:c2f5:1c59:a110:d980","2620:2d:4000:1::2a","HTTP","173","","","GET / HTTP/1.1 "
"287","4.536486295","172.20.10.8","51.137.91.111","TCP","66","","","36098  >  443 [ACK] Seq=2070 Ack=7186 Win=64128 Len=0 TSval=331472907 TSecr=1480248615"
"288","4.543623177","20.185.212.106","172.20.10.8","TCP","1464","","","443  >  55062 [ACK] Seq=6130 Ack=2241 Win=31744 Len=1398 TSval=3875124618 TSecr=3021128940 [TCP segment of a reassembled PDU]"
"289","4.548005105","20.185.212.106","172.20.10.8","TLSv1.2","1397","","","Application Data"
"290","4.548031636","172.20.10.8","20.185.212.106","TCP","66","","","55062  >  443 [ACK] Seq=2241 Ack=8859 Win=64128 Len=0 TSval=3021129100 TSecr=3875124618"
"291","4.558304662","2620:2d:4000:1::2a","2a02:a020:41:bfaa:c2f5:1c59:a110:d980","TCP","86","","","80  >  47364 [ACK] Seq=1 Ack=88 Win=24064 Len=0 TSval=1667952616 TSecr=2692370514"
"292","4.570426704","2620:2d:4000:1::2a","2a02:a020:41:bfaa:c2f5:1c59:a110:d980","TCP","86","","","[TCP Previous segment not captured] 80  >  47364 [FIN, ACK] Seq=148 Ack=88 Win=24064 Len=0 TSval=1667952628 TSecr=2692370514"
"293","4.570426940","2620:2d:4000:1::2a","2a02:a020:41:bfaa:c2f5:1c59:a110:d980","TCP","233","","","[TCP Out-Of-Order] 80  >  47364 [PSH, ACK] Seq=1 Ack=88 Win=24064 Len=147 TSval=1667952628 TSecr=2692370514"
"294","4.570451239","2a02:a020:41:bfaa:c2f5:1c59:a110:d980","2620:2d:4000:1::2a","TCP","98","","","[TCP Dup ACK 285#1] 47364  >  80 [ACK] Seq=88 Ack=1 Win=65408 Len=0 TSval=2692370553 TSecr=1667952616 SLE=148 SRE=149"
"295","4.570486394","2a02:a020:41:bfaa:c2f5:1c59:a110:d980","2620:2d:4000:1::2a","TCP","86","","","47364  >  80 [ACK] Seq=88 Ack=149 Win=65280 Len=0 TSval=2692370553 TSecr=1667952628"
"296","4.570586645","2a02:a020:41:bfaa:c2f5:1c59:a110:d980","2620:2d:4000:1::2a","TCP","86","","","47364  >  80 [FIN, ACK] Seq=88 Ack=149 Win=65280 Len=0 TSval=2692370553 TSecr=1667952628"
"297","4.587610861","20.185.212.106","172.20.10.8","TCP","1464","","","443  >  55078 [ACK] Seq=6130 Ack=2543 Win=34816 Len=1398 TSval=3875124671 TSecr=3021129009 [TCP segment of a reassembled PDU]"
"298","4.597971418","20.185.212.106","172.20.10.8","TLSv1.2","1240","","","Application Data"
"299","4.598112934","172.20.10.8","20.185.212.106","TCP","66","","","55078  >  443 [ACK] Seq=2543 Ack=8702 Win=64128 Len=0 TSval=3021129150 TSecr=3875124671"
"300","4.603618676","2620:2d:4000:1::2a","2a02:a020:41:bfaa:c2f5:1c59:a110:d980","TCP","86","","","80  >  47364 [ACK] Seq=149 Ack=89 Win=24064 Len=0 TSval=1667952656 TSecr=2692370553"
"301","4.608699224","172.20.10.8","20.185.212.106","TLSv1.2","3773","","","Application Data"
"302","4.610712330","172.20.10.8","20.185.212.106","TLSv1.2","3702","","","Application Data"
"303","4.613692625","172.20.10.8","20.185.212.106","TLSv1.2","3837","","","Application Data"
"304","4.619597752","20.185.212.106","172.20.10.8","TCP","1464","","","443  >  55092 [ACK] Seq=6130 Ack=2564 Win=31744 Len=1398 TSval=3875124694 TSecr=3021129027 [TCP segment of a reassembled PDU]"
"305","4.624039670","20.185.212.106","172.20.10.8","TLSv1.2","1419","","","Application Data"
"306","4.624112543","172.20.10.8","20.185.212.106","TCP","66","","","55092  >  443 [ACK] Seq=2564 Ack=8881 Win=64128 Len=0 TSval=3021129176 TSecr=3875124694"
"307","4.653383324","20.185.212.106","172.20.10.8","TCP","66","","","443  >  55078 [ACK] Seq=8702 Ack=3941 Win=37376 Len=0 TSval=3875124728 TSecr=3021129161"
"308","4.657875165","20.185.212.106","172.20.10.8","TCP","66","","","443  >  55078 [ACK] Seq=8702 Ack=5339 Win=39936 Len=0 TSval=3875124729 TSecr=3021129161"
"309","4.657875321","20.185.212.106","172.20.10.8","TCP","66","","","443  >  55078 [ACK] Seq=8702 Ack=6250 Win=43008 Len=0 TSval=3875124730 TSecr=3021129161"
"310","4.663869818","20.185.212.106","172.20.10.8","TCP","66","","","443  >  55062 [ACK] Seq=8859 Ack=3639 Win=34816 Len=0 TSval=3875124746 TSecr=3021129163"
"311","4.663870181","20.185.212.106","172.20.10.8","TCP","66","","","443  >  55062 [ACK] Seq=8859 Ack=5037 Win=37376 Len=0 TSval=3875124746 TSecr=3021129163"
"312","4.669996447","20.185.212.106","172.20.10.8","TCP","66","","","443  >  55062 [ACK] Seq=8859 Ack=5877 Win=39936 Len=0 TSval=3875124748 TSecr=3021129163"
"313","4.669996551","20.185.212.106","172.20.10.8","TCP","66","","","443  >  55048 [ACK] Seq=6397 Ack=5837 Win=37376 Len=0 TSval=3875124749 TSecr=3021129166"
"314","4.669996603","20.185.212.106","172.20.10.8","TCP","66","","","443  >  55048 [ACK] Seq=6397 Ack=7235 Win=39936 Len=0 TSval=3875124750 TSecr=3021129166"
"315","4.670412965","20.185.212.106","172.20.10.8","TCP","66","","","443  >  55048 [ACK] Seq=6397 Ack=8210 Win=43008 Len=0 TSval=3875124752 TSecr=3021129166"
"316","4.708388284","172.20.10.8","20.185.212.106","TLSv1.2","3839","","","Application Data"
"317","4.709508609","172.20.10.8","20.185.212.106","TCP","74","","","55098  >  443 [SYN] Seq=0 Win=64240 Len=0 MSS=1460 SACK_PERM=1 TSval=3021129262 TSecr=0 WS=128"
"318","4.710574874","172.20.10.8","20.185.212.106","TLSv1.2","277","","","Application Data"
"319","4.741396232","20.185.212.106","172.20.10.8","TCP","74","","","443  >  55098 [SYN, ACK] Seq=0 Ack=1 Win=23808 Len=0 MSS=1410 SACK_PERM=1 TSval=3875124824 TSecr=3021129262 WS=512"
"320","4.741405391","20.185.212.106","172.20.10.8","TLSv1.2","649","","","Application Data"
"321","4.741428903","172.20.10.8","20.185.212.106","TCP","66","","","55098  >  443 [ACK] Seq=1 Ack=1 Win=64256 Len=0 TSval=3021129294 TSecr=3875124824"
"322","4.742047521","172.20.10.8","20.185.212.106","TLSv1.2","583","","","Client Hello"
"323","4.743876164","172.20.10.8","20.185.212.106","TLSv1.2","3717","","","Application Data"
"324","4.754457330","20.185.212.106","172.20.10.8","TCP","66","","","443  >  55092 [ACK] Seq=8881 Ack=3962 Win=34816 Len=0 TSval=3875124829 TSecr=3021129261"
"325","4.759414648","20.185.212.106","172.20.10.8","TCP","66","","","443  >  55092 [ACK] Seq=8881 Ack=5360 Win=37376 Len=0 TSval=3875124831 TSecr=3021129261"
"326","4.759414840","20.185.212.106","172.20.10.8","TCP","66","","","443  >  55092 [ACK] Seq=8881 Ack=6337 Win=39936 Len=0 TSval=3875124831 TSecr=3021129261"
"327","4.759414893","20.185.212.106","172.20.10.8","TCP","66","","","443  >  55092 [ACK] Seq=8881 Ack=6548 Win=43008 Len=0 TSval=3875124831 TSecr=3021129263"
"328","4.760526185","20.185.212.106","172.20.10.8","TLSv1.2","897","","","Application Data"
"329","4.773456859","20.185.212.106","172.20.10.8","TCP","66","","","443  >  55098 [ACK] Seq=1 Ack=518 Win=25088 Len=0 TSval=3875124855 TSecr=3021129294"
"330","4.778157579","20.185.212.106","172.20.10.8","TCP","66","","","443  >  55078 [ACK] Seq=9285 Ack=7648 Win=45568 Len=0 TSval=3875124856 TSecr=3021129296"
"331","4.778157750","20.185.212.106","172.20.10.8","TCP","66","","","443  >  55078 [ACK] Seq=9285 Ack=9046 Win=48640 Len=0 TSval=3875124856 TSecr=3021129296"
"332","4.778157802","20.185.212.106","172.20.10.8","TCP","66","","","443  >  55078 [ACK] Seq=9285 Ack=9901 Win=51200 Len=0 TSval=3875124858 TSecr=3021129296"
"333","4.804498847","172.20.10.8","20.185.212.106","TCP","66","","","55062  >  443 [ACK] Seq=5877 Ack=9690 Win=64128 Len=0 TSval=3021129357 TSecr=3875124838"
"334","4.850847589","20.185.212.106","172.20.10.8","TCP","1464","","","443  >  55092 [ACK] Seq=8881 Ack=6548 Win=43008 Len=1398 TSval=3875124925 TSecr=3021129263 [TCP segment of a reassembled PDU]"
"335","4.855941557","20.185.212.106","172.20.10.8","TLSv1.2","1080","","","Application Data"
"336","4.856112178","172.20.10.8","20.185.212.106","TCP","66","","","55092  >  443 [ACK] Seq=6548 Ack=11293 Win=64128 Len=0 TSval=3021129408 TSecr=3875124925"
"337","4.873497243","20.185.212.106","172.20.10.8","TLSv1.2","862","","","Application Data"
"338","4.873523267","172.20.10.8","20.185.212.106","TCP","66","","","55048  >  443 [ACK] Seq=8210 Ack=7193 Win=63360 Len=0 TSval=3021129426 TSecr=3875124948"
"339","4.877987872","20.185.212.106","172.20.10.8","TLSv1.2","862","","","Application Data"
"340","4.878023464","172.20.10.8","20.185.212.106","TCP","54","","","36630  >  443 [RST] Seq=1 Win=0 Len=0"
"341","4.877988169","20.185.212.106","172.20.10.8","TCP","66","","","443  >  36630 [FIN, ACK] Seq=797 Ack=1 Win=395 Len=0 TSval=3875124949 TSecr=3021110426"
"342","4.878073205","172.20.10.8","20.185.212.106","TCP","54","","","36630  >  443 [RST] Seq=1 Win=0 Len=0"
"343","4.886138744","172.20.10.8","20.185.212.106","TLSv1.2","3848","","","Application Data"
"344","4.925344704","20.185.212.106","172.20.10.8","TCP","66","","","443  >  55048 [ACK] Seq=7193 Ack=9608 Win=45568 Len=0 TSval=3875125007 TSecr=3021129438"
"345","4.935978020","20.185.212.106","172.20.10.8","TCP","66","","","443  >  55048 [ACK] Seq=7193 Ack=11006 Win=48640 Len=0 TSval=3875125009 TSecr=3021129438"
"346","4.935978232","20.185.212.106","172.20.10.8","TCP","66","","","443  >  55048 [ACK] Seq=7193 Ack=11992 Win=51200 Len=0 TSval=3875125009 TSecr=3021129438"
"347","4.943699514","20.185.212.106","172.20.10.8","TCP","1464","","","443  >  55098 [ACK] Seq=1 Ack=518 Win=25088 Len=1398 TSval=3875125018 TSecr=3021129294 [TCP segment of a reassembled PDU]"
"348","4.943726364","172.20.10.8","20.185.212.106","TCP","66","","","55098  >  443 [ACK] Seq=518 Ack=1399 Win=63104 Len=0 TSval=3021129496 TSecr=3875125018"
"349","4.948674709","20.185.212.106","172.20.10.8","TCP","1464","","","443  >  55098 [PSH, ACK] Seq=1399 Ack=518 Win=25088 Len=1398 TSval=3875125018 TSecr=3021129294 [TCP segment of a reassembled PDU]"
"350","4.948687419","172.20.10.8","20.185.212.106","TCP","66","","","55098  >  443 [ACK] Seq=518 Ack=2797 Win=63104 Len=0 TSval=3021129501 TSecr=3875125018"
"351","4.948674913","20.185.212.106","172.20.10.8","TCP","2862","","","443  >  55098 [PSH, ACK] Seq=2797 Ack=518 Win=25088 Len=2796 TSval=3875125018 TSecr=3021129294 [TCP segment of a reassembled PDU]"
"352","4.948710247","172.20.10.8","20.185.212.106","TCP","66","","","55098  >  443 [ACK] Seq=518 Ack=5593 Win=60416 Len=0 TSval=3021129501 TSecr=3875125018"
"353","4.949007673","20.185.212.106","172.20.10.8","TLSv1.2","552","","","Server Hello, Certificate, Certificate Status, Server Key Exchange, Server Hello Done"
"354","4.949014297","172.20.10.8","20.185.212.106","TCP","66","","","55098  >  443 [ACK] Seq=518 Ack=6079 Win=63104 Len=0 TSval=3021129501 TSecr=3875125018"
"355","4.949053195","20.185.212.106","172.20.10.8","TLSv1.2","590","","","Application Data"
"356","4.951651345","172.20.10.8","20.185.212.106","TLSv1.2","224","","","Client Key Exchange, Change Cipher Spec, Encrypted Handshake Message"
"357","4.976508545","20.185.212.106","172.20.10.8","TCP","66","","","443  >  55098 [ACK] Seq=6079 Ack=676 Win=26112 Len=0 TSval=3875125057 TSecr=3021129504"
"358","4.992543076","172.20.10.8","20.185.212.106","TCP","66","","","55078  >  443 [ACK] Seq=9901 Ack=9809 Win=64128 Len=0 TSval=3021129545 TSecr=3875125027"
"359","5.074868450","20.185.212.106","172.20.10.8","TLSv1.2","117","","","Change Cipher Spec, Encrypted Handshake Message"
"360","5.120495114","172.20.10.8","20.185.212.106","TCP","66","","","55098  >  443 [ACK] Seq=676 Ack=6130 Win=64128 Len=0 TSval=3021129673 TSecr=3875125144"
