"No.","Time","Source","Destination","Protocol","Length","Destination Port","Source Port","Info"
"1","0.000000000","192.168.0.25","224.0.0.251","MDNS","283","5353","5353","Standard query 0x0000 ANY {""nm"":""Redmi 10 2022"",""as"":""[8194]"",""ip"":""25""}._mi-connect._udp.local, ""QU"" question ANY Android-2.local, ""QU"" question ANY Android-2.local, ""QU"" question ANY Android-2.local, ""QU"" question ANY Android-2.local, ""QU"" question SRV 0 0 56666 Android-2.local A 192.168.0.25 AAAA fe80::9b44:993a:ec84:49a AAAA 2a02:2788:7d4:2bf:4dec:99aa:227e:bd16 AAAA 2a02:2788:7d4:2bf:a3ee:17fd:54ec:db9a"
"2","0.000546483","fe80::9b44:993a:ec84:49a","ff02::fb","MDNS","303","5353","5353","Standard query 0x0000 ANY {""nm"":""Redmi 10 2022"",""as"":""[8194]"",""ip"":""25""}._mi-connect._udp.local, ""QU"" question ANY Android-2.local, ""QU"" question ANY Android-2.local, ""QU"" question ANY Android-2.local, ""QU"" question ANY Android-2.local, ""QU"" question SRV 0 0 56666 Android-2.local A 192.168.0.25 AAAA fe80::9b44:993a:ec84:49a AAAA 2a02:2788:7d4:2bf:4dec:99aa:227e:bd16 AAAA 2a02:2788:7d4:2bf:a3ee:17fd:54ec:db9a"
"3","0.249848238","192.168.0.25","224.0.0.251","MDNS","283","5353","5353","Standard query 0x0000 ANY {""nm"":""Redmi 10 2022"",""as"":""[8194]"",""ip"":""25""}._mi-connect._udp.local, ""QM"" question ANY Android-2.local, ""QM"" question ANY Android-2.local, ""QM"" question ANY Android-2.local, ""QM"" question ANY Android-2.local, ""QM"" question SRV 0 0 56666 Android-2.local A 192.168.0.25 AAAA fe80::9b44:993a:ec84:49a AAAA 2a02:2788:7d4:2bf:4dec:99aa:227e:bd16 AAAA 2a02:2788:7d4:2bf:a3ee:17fd:54ec:db9a"
"4","0.249849380","fe80::9b44:993a:ec84:49a","ff02::fb","MDNS","303","5353","5353","Standard query 0x0000 ANY {""nm"":""Redmi 10 2022"",""as"":""[8194]"",""ip"":""25""}._mi-connect._udp.local, ""QM"" question ANY Android-2.local, ""QM"" question ANY Android-2.local, ""QM"" question ANY Android-2.local, ""QM"" question ANY Android-2.local, ""QM"" question SRV 0 0 56666 Android-2.local A 192.168.0.25 AAAA fe80::9b44:993a:ec84:49a AAAA 2a02:2788:7d4:2bf:4dec:99aa:227e:bd16 AAAA 2a02:2788:7d4:2bf:a3ee:17fd:54ec:db9a"
"5","0.465245796","fe80::9b44:993a:ec84:49a","ff02::16","ICMPv6","90","","","Multicast Listener Report Message v2"
"6","0.500374658","192.168.0.25","224.0.0.251","MDNS","283","5353","5353","Standard query 0x0000 ANY {""nm"":""Redmi 10 2022"",""as"":""[8194]"",""ip"":""25""}._mi-connect._udp.local, ""QM"" question ANY Android-2.local, ""QM"" question ANY Android-2.local, ""QM"" question ANY Android-2.local, ""QM"" question ANY Android-2.local, ""QM"" question SRV 0 0 56666 Android-2.local A 192.168.0.25 AAAA fe80::9b44:993a:ec84:49a AAAA 2a02:2788:7d4:2bf:4dec:99aa:227e:bd16 AAAA 2a02:2788:7d4:2bf:a3ee:17fd:54ec:db9a"
"7","0.500990155","fe80::9b44:993a:ec84:49a","ff02::fb","MDNS","303","5353","5353","Standard query 0x0000 ANY {""nm"":""Redmi 10 2022"",""as"":""[8194]"",""ip"":""25""}._mi-connect._udp.local, ""QM"" question ANY Android-2.local, ""QM"" question ANY Android-2.local, ""QM"" question ANY Android-2.local, ""QM"" question ANY Android-2.local, ""QM"" question SRV 0 0 56666 Android-2.local A 192.168.0.25 AAAA fe80::9b44:993a:ec84:49a AAAA 2a02:2788:7d4:2bf:4dec:99aa:227e:bd16 AAAA 2a02:2788:7d4:2bf:a3ee:17fd:54ec:db9a"
"8","0.751586096","192.168.0.25","224.0.0.251","MDNS","783","5353","5353","Standard query response 0x0000 TXT, cache flush PTR _mi-connect._udp.local PTR {""nm"":""Redmi 10 2022"",""as"":""[8194]"",""ip"":""25""}._mi-connect._udp.local SRV, cache flush 0 0 56666 Android-2.local PTR, cache flush Android-2.local PTR, cache flush Android-2.local PTR, cache flush Android-2.local PTR, cache flush Android-2.local A, cache flush 192.168.0.25 AAAA, cache flush fe80::9b44:993a:ec84:49a AAAA, cache flush 2a02:2788:7d4:2bf:4dec:99aa:227e:bd16 AAAA, cache flush 2a02:2788:7d4:2bf:a3ee:17fd:54ec:db9a NSEC, cache flush {""nm"":""Redmi 10 2022"",""as"":""[8194]"",""ip"":""25""}._mi-connect._udp.local NSEC, cache flush 25.0.168.192.in-addr.arpa NSEC, cache flush A.9.4.0.4.8.C.E.A.3.9.9.4.4.B.9.0.0.0.0.0.0.0.0.0.0.0.0.0.8.E.F.ip6.arpa NSEC, cache flush 6.1.D.B.E.7.2.2.A.A.9.9.C.E.D.4.F.B.2.0.4.D.7.0.8.8.7.2.2.0.A.2.ip6.arpa NSEC, cache flush A.9.B.D.C.E.4.5.D.F.7.1.E.E.3.A.F.B.2.0.4.D.7.0.8.8.7.2.2.0.A.2.ip6.arpa NSEC, cache flush Android-2.local"
"9","0.751693256","fe80::9b44:993a:ec84:49a","ff02::fb","MDNS","803","5353","5353","Standard query response 0x0000 TXT, cache flush PTR _mi-connect._udp.local PTR {""nm"":""Redmi 10 2022"",""as"":""[8194]"",""ip"":""25""}._mi-connect._udp.local SRV, cache flush 0 0 56666 Android-2.local PTR, cache flush Android-2.local PTR, cache flush Android-2.local PTR, cache flush Android-2.local PTR, cache flush Android-2.local A, cache flush 192.168.0.25 AAAA, cache flush fe80::9b44:993a:ec84:49a AAAA, cache flush 2a02:2788:7d4:2bf:4dec:99aa:227e:bd16 AAAA, cache flush 2a02:2788:7d4:2bf:a3ee:17fd:54ec:db9a NSEC, cache flush {""nm"":""Redmi 10 2022"",""as"":""[8194]"",""ip"":""25""}._mi-connect._udp.local NSEC, cache flush 25.0.168.192.in-addr.arpa NSEC, cache flush A.9.4.0.4.8.C.E.A.3.9.9.4.4.B.9.0.0.0.0.0.0.0.0.0.0.0.0.0.8.E.F.ip6.arpa NSEC, cache flush 6.1.D.B.E.7.2.2.A.A.9.9.C.E.D.4.F.B.2.0.4.D.7.0.8.8.7.2.2.0.A.2.ip6.arpa NSEC, cache flush A.9.B.D.C.E.4.5.D.F.7.1.E.E.3.A.F.B.2.0.4.D.7.0.8.8.7.2.2.0.A.2.ip6.arpa NSEC, cache flush Android-2.local"
"10","1.269548476","BelkinIn_73:0c:6b","Spanning-tree-(for-bridges)_00","STP","60","","","Conf. Root = 32768/0/60:38:e0:73:0c:6b  Cost = 0  Port = 0x8001"
"11","1.728503225","192.168.0.40","9.9.9.9","DNS","89","53","49945","Standard query 0x9fe0 A a.config.skype.com OPT"
"12","1.728591757","192.168.0.40","9.9.9.9","DNS","89","53","44555","Standard query 0xe93a AAAA a.config.skype.com OPT"
"13","1.747629370","9.9.9.9","192.168.0.40","DNS","241","49945","53","Standard query response 0x9fe0 A a.config.skype.com CNAME skypeecs-prod-edge-a.trafficmanager.net CNAME l-0007.config.skype.com CNAME config-edge-skype.l-0007.l-msedge.net CNAME l-0007.l-msedge.net A 13.107.42.16 OPT"
"14","1.749456848","9.9.9.9","192.168.0.40","DNS","339","44555","53","Standard query response 0xe93a AAAA a.config.skype.com CNAME skypeecs-prod-edge-a.trafficmanager.net CNAME mira.config.skype.com CNAME svc.ha-teams.office.com CNAME svc.ms-acdc-teams.office.com AAAA 2603:1063:21:19c:: AAAA 2603:1063:21:152:: AAAA 2603:1063:21:177:: AAAA 2603:1063:21:145:: OPT"
"15","1.754937516","192.168.0.25","224.0.0.251","MDNS","783","5353","5353","Standard query response 0x0000 TXT, cache flush PTR _mi-connect._udp.local PTR {""nm"":""Redmi 10 2022"",""as"":""[8194]"",""ip"":""25""}._mi-connect._udp.local SRV, cache flush 0 0 56666 Android-2.local PTR, cache flush Android-2.local PTR, cache flush Android-2.local PTR, cache flush Android-2.local PTR, cache flush Android-2.local A, cache flush 192.168.0.25 AAAA, cache flush fe80::9b44:993a:ec84:49a AAAA, cache flush 2a02:2788:7d4:2bf:4dec:99aa:227e:bd16 AAAA, cache flush 2a02:2788:7d4:2bf:a3ee:17fd:54ec:db9a NSEC, cache flush {""nm"":""Redmi 10 2022"",""as"":""[8194]"",""ip"":""25""}._mi-connect._udp.local NSEC, cache flush 25.0.168.192.in-addr.arpa NSEC, cache flush A.9.4.0.4.8.C.E.A.3.9.9.4.4.B.9.0.0.0.0.0.0.0.0.0.0.0.0.0.8.E.F.ip6.arpa NSEC, cache flush 6.1.D.B.E.7.2.2.A.A.9.9.C.E.D.4.F.B.2.0.4.D.7.0.8.8.7.2.2.0.A.2.ip6.arpa NSEC, cache flush A.9.B.D.C.E.4.5.D.F.7.1.E.E.3.A.F.B.2.0.4.D.7.0.8.8.7.2.2.0.A.2.ip6.arpa NSEC, cache flush Android-2.local"
"16","1.754990822","fe80::9b44:993a:ec84:49a","ff02::fb","MDNS","803","5353","5353","Standard query response 0x0000 TXT, cache flush PTR _mi-connect._udp.local PTR {""nm"":""Redmi 10 2022"",""as"":""[8194]"",""ip"":""25""}._mi-connect._udp.local SRV, cache flush 0 0 56666 Android-2.local PTR, cache flush Android-2.local PTR, cache flush Android-2.local PTR, cache flush Android-2.local PTR, cache flush Android-2.local A, cache flush 192.168.0.25 AAAA, cache flush fe80::9b44:993a:ec84:49a AAAA, cache flush 2a02:2788:7d4:2bf:4dec:99aa:227e:bd16 AAAA, cache flush 2a02:2788:7d4:2bf:a3ee:17fd:54ec:db9a NSEC, cache flush {""nm"":""Redmi 10 2022"",""as"":""[8194]"",""ip"":""25""}._mi-connect._udp.local NSEC, cache flush 25.0.168.192.in-addr.arpa NSEC, cache flush A.9.4.0.4.8.C.E.A.3.9.9.4.4.B.9.0.0.0.0.0.0.0.0.0.0.0.0.0.8.E.F.ip6.arpa NSEC, cache flush 6.1.D.B.E.7.2.2.A.A.9.9.C.E.D.4.F.B.2.0.4.D.7.0.8.8.7.2.2.0.A.2.ip6.arpa NSEC, cache flush A.9.B.D.C.E.4.5.D.F.7.1.E.E.3.A.F.B.2.0.4.D.7.0.8.8.7.2.2.0.A.2.ip6.arpa NSEC, cache flush Android-2.local"
"17","1.845083152","192.168.0.40","13.107.42.16","TCP","74","","","49630  >  443 [SYN] Seq=0 Win=64240 Len=0 MSS=1460 SACK_PERM=1 TSval=3714858691 TSecr=0 WS=128"
"18","1.856770292","13.107.42.16","192.168.0.40","TCP","66","","","443  >  49630 [SYN, ACK] Seq=0 Ack=1 Win=65535 Len=0 MSS=1440 WS=256 SACK_PERM=1"
"19","1.856803764","192.168.0.40","13.107.42.16","TCP","54","","","49630  >  443 [ACK] Seq=1 Ack=1 Win=64256 Len=0"
"20","1.919709314","192.168.0.40","9.9.9.9","DNS","85","53","58232","Standard query 0x67c6 A pipe.skype.com OPT"
"21","1.919780890","192.168.0.40","9.9.9.9","DNS","85","53","58243","Standard query 0x7c7f AAAA pipe.skype.com OPT"
"22","1.920547357","192.168.0.40","13.107.42.16","TLSv1.2","311","","","Client Hello"
"23","1.933594620","13.107.42.16","192.168.0.40","TCP","60","","","443  >  49630 [ACK] Seq=1 Ack=258 Win=4194304 Len=0"
"24","1.935331727","13.107.42.16","192.168.0.40","TCP","1514","","","443  >  49630 [ACK] Seq=1 Ack=258 Win=4194304 Len=1460 [TCP segment of a reassembled PDU]"
"25","1.935350669","192.168.0.40","13.107.42.16","TCP","54","","","49630  >  443 [ACK] Seq=258 Ack=1461 Win=64128 Len=0"
"26","1.935445234","13.107.42.16","192.168.0.40","TCP","1514","","","443  >  49630 [ACK] Seq=1461 Ack=258 Win=4194304 Len=1460 [TCP segment of a reassembled PDU]"
"27","1.935452874","192.168.0.40","13.107.42.16","TCP","54","","","49630  >  443 [ACK] Seq=258 Ack=2921 Win=63360 Len=0"
"28","1.935545823","13.107.42.16","192.168.0.40","TLSv1.2","1304","","","Server Hello, Certificate, Server Key Exchange, Server Hello Done"
"29","1.935550466","192.168.0.40","13.107.42.16","TCP","54","","","49630  >  443 [ACK] Seq=258 Ack=4171 Win=62464 Len=0"
"30","1.937185451","192.168.0.40","13.107.42.16","TLSv1.2","212","","","Client Key Exchange, Change Cipher Spec, Encrypted Handshake Message"
"31","1.939445128","9.9.9.9","192.168.0.40","DNS","265","58243","53","Standard query response 0x7c7f AAAA pipe.skype.com CNAME global.aria.events.data.trafficmanager.net CNAME onedscolprdeus08.eastus.cloudapp.azure.com SOA ns1-201.azure-dns.com OPT"
"32","1.939731653","192.168.0.40","9.9.9.9","DNS","113","53","55481","Standard query 0xddae AAAA onedscolprdeus08.eastus.cloudapp.azure.com OPT"
"33","1.949222283","13.107.42.16","192.168.0.40","TCP","60","","","443  >  49630 [ACK] Seq=4171 Ack=416 Win=4194048 Len=0"
"34","1.950643778","13.107.42.16","192.168.0.40","TLSv1.2","396","","","New Session Ticket, Change Cipher Spec, Encrypted Handshake Message"
"35","1.952198356","192.168.0.40","13.107.42.16","TLSv1.2","348","","","Application Data"
"36","1.953483323","9.9.9.9","192.168.0.40","DNS","210","58232","53","Standard query response 0x67c6 A pipe.skype.com CNAME global.aria.events.data.trafficmanager.net CNAME onedscolprdeus01.eastus.cloudapp.azure.com A 52.168.112.66 OPT"
"37","1.962143637","13.107.42.16","192.168.0.40","TCP","60","","","443  >  49630 [ACK] Seq=4513 Ack=710 Win=4193792 Len=0"
"38","1.963687231","9.9.9.9","192.168.0.40","DNS","184","55481","53","Standard query response 0xddae AAAA onedscolprdeus08.eastus.cloudapp.azure.com SOA ns1-201.azure-dns.com OPT"
"39","1.964347270","192.168.0.40","52.168.112.66","TCP","74","","","34774  >  443 [SYN] Seq=0 Win=64240 Len=0 MSS=1460 SACK_PERM=1 TSval=3881816955 TSecr=0 WS=128"
"40","2.059859103","52.168.112.66","192.168.0.40","TCP","66","","","443  >  34774 [SYN, ACK] Seq=0 Ack=1 Win=65535 Len=0 MSS=1440 WS=256 SACK_PERM=1"
"41","2.059902095","192.168.0.40","52.168.112.66","TCP","54","","","34774  >  443 [ACK] Seq=1 Ack=1 Win=64256 Len=0"
"42","2.060150755","192.168.0.40","52.168.112.66","TLSv1.2","307","","","Client Hello"
"43","2.081468618","13.107.42.16","192.168.0.40","TLSv1.2","1292","","","Application Data"
"44","2.081593899","13.107.42.16","192.168.0.40","TCP","60","","","443  >  49630 [FIN, ACK] Seq=5751 Ack=710 Win=4193792 Len=0"
"45","2.083200815","192.168.0.40","13.107.42.16","TLSv1.2","85","","","Encrypted Alert"
"46","2.084844155","192.168.0.40","13.107.42.16","TCP","54","","","49630  >  443 [FIN, ACK] Seq=741 Ack=5752 Win=64128 Len=0"
"47","2.094264577","13.107.42.16","192.168.0.40","TCP","60","","","[TCP Dup ACK 37#1] 443  >  49630 [ACK] Seq=5752 Ack=710 Win=4193792 Len=0"
"48","2.099990795","13.107.42.16","192.168.0.40","TCP","60","","","443  >  49630 [ACK] Seq=5752 Ack=742 Win=4193792 Len=0"
"49","2.172597628","52.168.112.66","192.168.0.40","TCP","1514","","","443  >  34774 [ACK] Seq=1 Ack=254 Win=525312 Len=1460 [TCP segment of a reassembled PDU]"
"50","2.172625163","192.168.0.40","52.168.112.66","TCP","54","","","34774  >  443 [ACK] Seq=254 Ack=1461 Win=64128 Len=0"
"51","2.172701610","52.168.112.66","192.168.0.40","TCP","1514","","","443  >  34774 [ACK] Seq=1461 Ack=254 Win=525312 Len=1460 [TCP segment of a reassembled PDU]"
"52","2.172707784","192.168.0.40","52.168.112.66","TCP","54","","","34774  >  443 [ACK] Seq=254 Ack=2921 Win=63360 Len=0"
"53","2.172835482","52.168.112.66","192.168.0.40","TCP","1514","","","443  >  34774 [ACK] Seq=2921 Ack=254 Win=525312 Len=1460 [TCP segment of a reassembled PDU]"
"54","2.172840331","192.168.0.40","52.168.112.66","TCP","54","","","34774  >  443 [ACK] Seq=254 Ack=4381 Win=64128 Len=0"
"55","2.172835934","52.168.112.66","192.168.0.40","TLSv1.2","176","","","Server Hello, Certificate, Server Key Exchange, Server Hello Done"
"56","2.172845467","192.168.0.40","52.168.112.66","TCP","54","","","34774  >  443 [ACK] Seq=254 Ack=4503 Win=64128 Len=0"
"57","2.174409612","192.168.0.40","52.168.112.66","TLSv1.2","212","","","Client Key Exchange, Change Cipher Spec, Encrypted Handshake Message"
"58","2.278058904","52.168.112.66","192.168.0.40","TLSv1.2","105","","","Change Cipher Spec, Encrypted Handshake Message"
"59","2.281124308","192.168.0.40","52.168.112.66","TLSv1.2","1414","","","Application Data"
"60","2.380053830","52.168.112.66","192.168.0.40","TLSv1.2","544","","","Application Data"
"61","2.380518786","192.168.0.40","52.168.112.66","TLSv1.2","85","","","Encrypted Alert"
"62","2.380910278","192.168.0.40","52.168.112.66","TCP","54","","","34774  >  443 [FIN, ACK] Seq=1803 Ack=5045 Win=64128 Len=0"
"63","2.474470263","52.168.112.66","192.168.0.40","TCP","60","","","[TCP Dup ACK 60#1] 443  >  34774 [ACK] Seq=5045 Ack=1772 Win=525568 Len=0"
"64","2.478519141","52.168.112.66","192.168.0.40","TCP","60","","","443  >  34774 [ACK] Seq=5045 Ack=1804 Win=525568 Len=0"
"65","3.269660245","BelkinIn_73:0c:6b","Spanning-tree-(for-bridges)_00","STP","60","","","Conf. Root = 32768/0/60:38:e0:73:0c:6b  Cost = 0  Port = 0x8001"
"66","3.648538026","192.168.0.40","9.9.9.9","DNS","94","53","60316","Standard query 0xf973 A www.msftconnecttest.com OPT"
"67","3.648619136","192.168.0.40","9.9.9.9","DNS","94","53","46812","Standard query 0xa950 AAAA www.msftconnecttest.com OPT"
"68","3.662413072","9.9.9.9","192.168.0.40","DNS","230","60316","53","Standard query response 0xf973 A www.msftconnecttest.com CNAME ncsi-geo.trafficmanager.net CNAME v4ncsi.msedge.net CNAME ncsi.4-c-0003.c-msedge.net CNAME 4-c-0003.c-msedge.net A 13.107.4.52 OPT"
"69","3.663828647","192.168.0.40","9.9.9.9","DNS","121","53","51298","Standard query 0xa6ba AAAA ip.azeus1-client-s.msnmessenger.msn.com.akadns.net OPT"
"70","3.683663417","9.9.9.9","192.168.0.40","DNS","187","51298","53","Standard query response 0xa6ba AAAA ip.azeus1-client-s.msnmessenger.msn.com.akadns.net SOA internal.akadns.net OPT"
"71","3.684274379","192.168.0.40","20.185.212.106","TCP","74","","","34806  >  443 [SYN] Seq=0 Win=64240 Len=0 MSS=1460 SACK_PERM=1 TSval=1373729096 TSecr=0 WS=128"
"72","3.686537597","9.9.9.9","192.168.0.40","DNS","271","46812","53","Standard query response 0xa950 AAAA www.msftconnecttest.com CNAME ncsi-geo.trafficmanager.net CNAME v4ncsi.msedge.net CNAME ncsi.4-c-0003.c-msedge.net CNAME 4-c-0003.c-msedge.net SOA ns1.c-msedge.net OPT"
"73","3.686790864","192.168.0.40","9.9.9.9","DNS","92","53","39877","Standard query 0x6441 AAAA 4-c-0003.c-msedge.net OPT"
"74","3.700482104","192.168.0.40","9.9.9.9","DNS","88","53","32922","Standard query 0x12aa A api.asm.skype.com OPT"
"75","3.700586517","192.168.0.40","9.9.9.9","DNS","88","53","41105","Standard query 0x6405 AAAA api.asm.skype.com OPT"
"76","3.704030351","9.9.9.9","192.168.0.40","DNS","152","39877","53","Standard query response 0x6441 AAAA 4-c-0003.c-msedge.net SOA ns1.c-msedge.net OPT"
"77","3.704296552","192.168.0.40","13.107.4.52","TCP","74","","","42348  >  80 [SYN] Seq=0 Win=64240 Len=0 MSS=1460 SACK_PERM=1 TSval=1929384838 TSecr=0 WS=128"
"78","3.710436169","13.107.4.52","192.168.0.40","TCP","66","","","80  >  42348 [SYN, ACK] Seq=0 Ack=1 Win=65535 Len=0 MSS=1440 WS=256 SACK_PERM=1"
"79","3.710554327","192.168.0.40","13.107.4.52","TCP","54","","","42348  >  80 [ACK] Seq=1 Ack=1 Win=64256 Len=0"
"80","3.710916037","192.168.0.40","13.107.4.52","HTTP","465","","","GET /connecttest.txt?n=1680200002793 HTTP/1.1 "
"81","3.719386141","9.9.9.9","192.168.0.40","DNS","201","32922","53","Standard query response 0x12aa A api.asm.skype.com CNAME asm-api-prod-version-skype.trafficmanager.net CNAME weu1-api-skype.cloudapp.net A 52.113.199.175 OPT"
"82","3.719712733","9.9.9.9","192.168.0.40","DNS","256","41105","53","Standard query response 0x6405 AAAA api.asm.skype.com CNAME asm-api-prod-version-skype.trafficmanager.net CNAME weu1-api-skype.cloudapp.net SOA ns1-201.azure-dns.com OPT"
"83","3.719888614","192.168.0.40","9.9.9.9","DNS","98","53","46624","Standard query 0xbe52 AAAA weu1-api-skype.cloudapp.net OPT"
"84","3.719957060","13.107.4.52","192.168.0.40","TCP","60","","","80  >  42348 [ACK] Seq=1 Ack=412 Win=4194048 Len=0"
"85","3.722392096","13.107.4.52","192.168.0.40","HTTP","574","","","HTTP/1.1 200 OK  (text/plain)"
"86","3.722404243","192.168.0.40","13.107.4.52","TCP","54","","","42348  >  80 [ACK] Seq=412 Ack=521 Win=64128 Len=0"
"87","3.735238624","9.9.9.9","192.168.0.40","DNS","172","46624","53","Standard query response 0xbe52 AAAA weu1-api-skype.cloudapp.net SOA ns1-201.azure-dns.com OPT"
"88","3.746820714","192.168.0.40","52.113.199.175","TCP","74","","","50382  >  443 [SYN] Seq=0 Win=64240 Len=0 MSS=1460 SACK_PERM=1 TSval=4024219533 TSecr=0 WS=128"
"89","3.747756819","192.168.0.40","20.185.212.106","TCP","74","","","34810  >  443 [SYN] Seq=0 Win=64240 Len=0 MSS=1460 SACK_PERM=1 TSval=1373729160 TSecr=0 WS=128"
"90","3.748246607","192.168.0.40","9.9.9.9","DNS","88","53","51543","Standard query 0xaea3 A api.aps.skype.com OPT"
"91","3.748341391","192.168.0.40","9.9.9.9","DNS","88","53","45142","Standard query 0x49b2 AAAA api.aps.skype.com OPT"
"92","3.765309625","52.113.199.175","192.168.0.40","TCP","66","","","443  >  50382 [SYN, ACK] Seq=0 Ack=1 Win=65535 Len=0 MSS=1440 WS=256 SACK_PERM=1"
"93","3.765379461","192.168.0.40","52.113.199.175","TCP","54","","","50382  >  443 [ACK] Seq=1 Ack=1 Win=64256 Len=0"
"94","3.765752960","192.168.0.40","52.113.199.175","TLSv1.2","571","","","Client Hello"
"95","3.767143279","9.9.9.9","192.168.0.40","DNS","193","51543","53","Standard query response 0xaea3 A api.aps.skype.com CNAME api-aps-teams.trafficmanager.net CNAME b-aps-euwe-01-skype.cloudapp.net A 51.144.253.41 OPT"
"96","3.770415196","192.168.0.40","9.9.9.9","DNS","96","53","36334","Standard query 0xb901 A open-ai-connect.skype.com OPT"
"97","3.770491848","192.168.0.40","9.9.9.9","DNS","96","53","34379","Standard query 0x193c AAAA open-ai-connect.skype.com OPT"
"98","3.774101642","9.9.9.9","192.168.0.40","DNS","248","45142","53","Standard query response 0x49b2 AAAA api.aps.skype.com CNAME api-aps-teams.trafficmanager.net CNAME b-aps-euwe-01-skype.cloudapp.net SOA ns1-201.azure-dns.com OPT"
"99","3.774300006","192.168.0.40","9.9.9.9","DNS","103","53","46106","Standard query 0x6869 AAAA b-aps-euwe-01-skype.cloudapp.net OPT"
"100","3.777496468","192.168.0.40","20.185.212.106","TCP","74","","","34812  >  443 [SYN] Seq=0 Win=64240 Len=0 MSS=1460 SACK_PERM=1 TSval=1373729190 TSecr=0 WS=128"
"101","3.779638789","192.168.0.40","20.185.212.106","TCP","74","","","34818  >  443 [SYN] Seq=0 Win=64240 Len=0 MSS=1460 SACK_PERM=1 TSval=1373729192 TSecr=0 WS=128"
"102","3.781431268","52.113.199.175","192.168.0.40","TCP","1514","","","443  >  50382 [ACK] Seq=1 Ack=518 Win=525056 Len=1460 [TCP segment of a reassembled PDU]"
"103","3.781493178","192.168.0.40","52.113.199.175","TCP","54","","","50382  >  443 [ACK] Seq=518 Ack=1461 Win=64128 Len=0"
"104","3.781518057","52.113.199.175","192.168.0.40","TCP","1514","","","443  >  50382 [ACK] Seq=1461 Ack=518 Win=525056 Len=1460 [TCP segment of a reassembled PDU]"
"105","3.781524058","192.168.0.40","52.113.199.175","TCP","54","","","50382  >  443 [ACK] Seq=518 Ack=2921 Win=63360 Len=0"
"106","3.781591807","52.113.199.175","192.168.0.40","TCP","1514","","","443  >  50382 [ACK] Seq=2921 Ack=518 Win=525056 Len=1460 [TCP segment of a reassembled PDU]"
"107","3.781597640","192.168.0.40","52.113.199.175","TCP","54","","","50382  >  443 [ACK] Seq=518 Ack=4381 Win=62336 Len=0"
"108","3.781699101","52.113.199.175","192.168.0.40","TLSv1.2","1332","","","Server Hello, Certificate, Certificate Status, Server Key Exchange, Server Hello Done"
"109","3.781705721","192.168.0.40","52.113.199.175","TCP","54","","","50382  >  443 [ACK] Seq=518 Ack=5659 Win=64128 Len=0"
"110","3.783396961","20.185.212.106","192.168.0.40","TCP","66","","","443  >  34806 [SYN, ACK] Seq=0 Ack=1 Win=65535 Len=0 MSS=1440 WS=256 SACK_PERM=1"
"111","3.783444674","192.168.0.40","20.185.212.106","TCP","54","","","34806  >  443 [ACK] Seq=1 Ack=1 Win=64256 Len=0"
"112","3.783703963","192.168.0.40","20.185.212.106","TLSv1.2","571","","","Client Hello"
"113","3.784298671","192.168.0.25","224.0.0.251","MDNS","783","5353","5353","Standard query response 0x0000 TXT, cache flush PTR _mi-connect._udp.local PTR {""nm"":""Redmi 10 2022"",""as"":""[8194]"",""ip"":""25""}._mi-connect._udp.local SRV, cache flush 0 0 56666 Android-2.local PTR, cache flush Android-2.local PTR, cache flush Android-2.local PTR, cache flush Android-2.local PTR, cache flush Android-2.local A, cache flush 192.168.0.25 AAAA, cache flush fe80::9b44:993a:ec84:49a AAAA, cache flush 2a02:2788:7d4:2bf:4dec:99aa:227e:bd16 AAAA, cache flush 2a02:2788:7d4:2bf:a3ee:17fd:54ec:db9a NSEC, cache flush {""nm"":""Redmi 10 2022"",""as"":""[8194]"",""ip"":""25""}._mi-connect._udp.local NSEC, cache flush 25.0.168.192.in-addr.arpa NSEC, cache flush A.9.4.0.4.8.C.E.A.3.9.9.4.4.B.9.0.0.0.0.0.0.0.0.0.0.0.0.0.8.E.F.ip6.arpa NSEC, cache flush 6.1.D.B.E.7.2.2.A.A.9.9.C.E.D.4.F.B.2.0.4.D.7.0.8.8.7.2.2.0.A.2.ip6.arpa NSEC, cache flush A.9.B.D.C.E.4.5.D.F.7.1.E.E.3.A.F.B.2.0.4.D.7.0.8.8.7.2.2.0.A.2.ip6.arpa NSEC, cache flush Android-2.local"
"114","3.784755331","fe80::9b44:993a:ec84:49a","ff02::fb","MDNS","803","5353","5353","Standard query response 0x0000 TXT, cache flush PTR _mi-connect._udp.local PTR {""nm"":""Redmi 10 2022"",""as"":""[8194]"",""ip"":""25""}._mi-connect._udp.local SRV, cache flush 0 0 56666 Android-2.local PTR, cache flush Android-2.local PTR, cache flush Android-2.local PTR, cache flush Android-2.local PTR, cache flush Android-2.local A, cache flush 192.168.0.25 AAAA, cache flush fe80::9b44:993a:ec84:49a AAAA, cache flush 2a02:2788:7d4:2bf:4dec:99aa:227e:bd16 AAAA, cache flush 2a02:2788:7d4:2bf:a3ee:17fd:54ec:db9a NSEC, cache flush {""nm"":""Redmi 10 2022"",""as"":""[8194]"",""ip"":""25""}._mi-connect._udp.local NSEC, cache flush 25.0.168.192.in-addr.arpa NSEC, cache flush A.9.4.0.4.8.C.E.A.3.9.9.4.4.B.9.0.0.0.0.0.0.0.0.0.0.0.0.0.8.E.F.ip6.arpa NSEC, cache flush 6.1.D.B.E.7.2.2.A.A.9.9.C.E.D.4.F.B.2.0.4.D.7.0.8.8.7.2.2.0.A.2.ip6.arpa NSEC, cache flush A.9.B.D.C.E.4.5.D.F.7.1.E.E.3.A.F.B.2.0.4.D.7.0.8.8.7.2.2.0.A.2.ip6.arpa NSEC, cache flush Android-2.local"
"115","3.788828187","192.168.0.40","52.113.199.175","TLSv1.2","212","","","Client Key Exchange, Change Cipher Spec, Encrypted Handshake Message"
"116","3.791624054","9.9.9.9","192.168.0.40","DNS","177","46106","53","Standard query response 0x6869 AAAA b-aps-euwe-01-skype.cloudapp.net SOA ns1-201.azure-dns.com OPT"
"117","3.791921543","192.168.0.40","51.144.253.41","TCP","74","","","46566  >  443 [SYN] Seq=0 Win=64240 Len=0 MSS=1460 SACK_PERM=1 TSval=3082637492 TSecr=0 WS=128"
"118","3.797551951","9.9.9.9","192.168.0.40","DNS","197","34379","53","Standard query response 0x193c AAAA open-ai-connect.skype.com CNAME open-ai-connect-skype-com.s-0006.s-msedge.net CNAME s-0006.s-msedge.net AAAA 2620:1ec:42::133 OPT"
"119","3.798881799","9.9.9.9","192.168.0.40","DNS","185","36334","53","Standard query response 0xb901 A open-ai-connect.skype.com CNAME open-ai-connect-skype-com.s-0006.s-msedge.net CNAME s-0006.s-msedge.net A 52.113.194.133 OPT"
"120","3.799715147","2a02:2788:7d4:2bf:5bdb:1111:310:4d67","2620:1ec:42::133","TCP","94","","","46562  >  443 [SYN] Seq=0 Win=64800 Len=0 MSS=1440 SACK_PERM=1 TSval=3675929456 TSecr=0 WS=128"
"121","3.810431668","52.113.199.175","192.168.0.40","TCP","60","","","443  >  50382 [ACK] Seq=5659 Ack=676 Win=524800 Len=0"
"122","3.811117088","51.144.253.41","192.168.0.40","TCP","66","","","443  >  46566 [SYN, ACK] Seq=0 Ack=1 Win=65535 Len=0 MSS=1440 WS=256 SACK_PERM=1"
"123","3.811132949","192.168.0.40","51.144.253.41","TCP","54","","","46566  >  443 [ACK] Seq=1 Ack=1 Win=64256 Len=0"
"124","3.811281721","192.168.0.40","51.144.253.41","TLSv1.2","571","","","Client Hello"
"125","3.812272776","52.113.199.175","192.168.0.40","TLSv1.2","105","","","Change Cipher Spec, Encrypted Handshake Message"
"126","3.812611343","192.168.0.40","52.113.199.175","TCP","1494","","","50382  >  443 [ACK] Seq=676 Ack=5710 Win=64128 Len=1440 [TCP segment of a reassembled PDU]"
"127","3.812620379","192.168.0.40","52.113.199.175","TLSv1.2","705","","","Application Data"
"128","3.812666075","192.168.0.40","52.113.199.175","TLSv1.2","732","","","Application Data"
"129","3.821643395","2620:1ec:42::133","2a02:2788:7d4:2bf:5bdb:1111:310:4d67","TCP","86","","","443  >  46562 [SYN, ACK] Seq=0 Ack=1 Win=65535 Len=0 MSS=1400 WS=256 SACK_PERM=1"
"130","3.821671163","2a02:2788:7d4:2bf:5bdb:1111:310:4d67","2620:1ec:42::133","TCP","74","","","46562  >  443 [ACK] Seq=1 Ack=1 Win=64896 Len=0"
"131","3.821861730","2a02:2788:7d4:2bf:5bdb:1111:310:4d67","2620:1ec:42::133","TLSv1.2","591","","","Client Hello"
"132","3.828897656","52.113.199.175","192.168.0.40","TCP","60","","","443  >  50382 [ACK] Seq=5710 Ack=3445 Win=525568 Len=0"
"133","3.831772835","51.144.253.41","192.168.0.40","TCP","1514","","","443  >  46566 [ACK] Seq=1 Ack=518 Win=525056 Len=1460 [TCP segment of a reassembled PDU]"
"134","3.831841605","192.168.0.40","51.144.253.41","TCP","54","","","46566  >  443 [ACK] Seq=518 Ack=1461 Win=64128 Len=0"
"135","3.832382245","51.144.253.41","192.168.0.40","TCP","1514","","","443  >  46566 [ACK] Seq=1461 Ack=518 Win=525056 Len=1460 [TCP segment of a reassembled PDU]"
"136","3.832389505","192.168.0.40","51.144.253.41","TCP","54","","","46566  >  443 [ACK] Seq=518 Ack=2921 Win=64128 Len=0"
"137","3.832520530","51.144.253.41","192.168.0.40","TCP","1514","","","443  >  46566 [ACK] Seq=2921 Ack=518 Win=525056 Len=1460 [TCP segment of a reassembled PDU]"
"138","3.832552451","192.168.0.40","51.144.253.41","TCP","54","","","46566  >  443 [ACK] Seq=518 Ack=4381 Win=64128 Len=0"
"139","3.832634791","51.144.253.41","192.168.0.40","TLSv1.2","1341","","","Server Hello, Certificate, Certificate Status, Server Key Exchange, Server Hello Done"
"140","3.832643186","192.168.0.40","51.144.253.41","TCP","54","","","46566  >  443 [ACK] Seq=518 Ack=5668 Win=64128 Len=0"
"141","3.832703014","52.113.199.175","192.168.0.40","TLSv1.2","1371","","","Application Data"
"142","3.837289797","192.168.0.40","51.144.253.41","TLSv1.2","212","","","Client Key Exchange, Change Cipher Spec, Encrypted Handshake Message"
"143","3.837426284","192.168.0.40","51.144.253.41","TLSv1.2","153","","","Application Data"
"144","3.837640132","192.168.0.40","51.144.253.41","TLSv1.2","1223","","","Application Data"
"145","3.837675557","192.168.0.40","51.144.253.41","TLSv1.2","178","","","Application Data"
"146","3.837682437","192.168.0.40","51.144.253.41","TLSv1.2","188","","","Application Data"
"147","3.841601964","2620:1ec:42::133","2a02:2788:7d4:2bf:5bdb:1111:310:4d67","TCP","74","","","443  >  46562 [ACK] Seq=1 Ack=518 Win=4194048 Len=0"
"148","3.843233861","2620:1ec:42::133","2a02:2788:7d4:2bf:5bdb:1111:310:4d67","TCP","1514","","","443  >  46562 [ACK] Seq=1 Ack=518 Win=4194048 Len=1440 [TCP segment of a reassembled PDU]"
"149","3.843243680","2a02:2788:7d4:2bf:5bdb:1111:310:4d67","2620:1ec:42::133","TCP","74","","","46562  >  443 [ACK] Seq=518 Ack=1441 Win=64128 Len=0"
"150","3.843426232","2620:1ec:42::133","2a02:2788:7d4:2bf:5bdb:1111:310:4d67","TCP","1514","","","443  >  46562 [ACK] Seq=1441 Ack=518 Win=4194048 Len=1440 [TCP segment of a reassembled PDU]"
"151","3.843431319","2a02:2788:7d4:2bf:5bdb:1111:310:4d67","2620:1ec:42::133","TCP","74","","","46562  >  443 [ACK] Seq=518 Ack=2881 Win=64128 Len=0"
"152","3.843588374","2620:1ec:42::133","2a02:2788:7d4:2bf:5bdb:1111:310:4d67","TCP","1514","","","443  >  46562 [ACK] Seq=2881 Ack=518 Win=4194048 Len=1440 [TCP segment of a reassembled PDU]"
"153","3.843593579","2a02:2788:7d4:2bf:5bdb:1111:310:4d67","2620:1ec:42::133","TCP","74","","","46562  >  443 [ACK] Seq=518 Ack=4321 Win=64128 Len=0"
"154","3.843605177","2620:1ec:42::133","2a02:2788:7d4:2bf:5bdb:1111:310:4d67","TCP","1514","","","443  >  46562 [ACK] Seq=4321 Ack=518 Win=4194048 Len=1440 [TCP segment of a reassembled PDU]"
"155","3.843608758","2a02:2788:7d4:2bf:5bdb:1111:310:4d67","2620:1ec:42::133","TCP","74","","","46562  >  443 [ACK] Seq=518 Ack=5761 Win=63488 Len=0"
"156","3.843605496","2620:1ec:42::133","2a02:2788:7d4:2bf:5bdb:1111:310:4d67","TLSv1.2","273","","","Server Hello, Certificate, Certificate Status, Server Key Exchange, Server Hello Done"
"157","3.843616191","2a02:2788:7d4:2bf:5bdb:1111:310:4d67","2620:1ec:42::133","TCP","74","","","46562  >  443 [ACK] Seq=518 Ack=5960 Win=63360 Len=0"
"158","3.843991166","20.185.212.106","192.168.0.40","TCP","66","","","443  >  34810 [SYN, ACK] Seq=0 Ack=1 Win=65535 Len=0 MSS=1440 WS=256 SACK_PERM=1"
"159","3.844008349","192.168.0.40","20.185.212.106","TCP","54","","","34810  >  443 [ACK] Seq=1 Ack=1 Win=64256 Len=0"
"160","3.844176160","192.168.0.40","20.185.212.106","TLSv1.2","571","","","Client Hello"
"161","3.846631936","2a02:2788:7d4:2bf:5bdb:1111:310:4d67","2620:1ec:42::133","TLSv1.2","232","","","Client Key Exchange, Change Cipher Spec, Encrypted Handshake Message"
"162","3.846726731","2a02:2788:7d4:2bf:5bdb:1111:310:4d67","2620:1ec:42::133","TLSv1.2","173","","","Application Data"
"163","3.846816183","2a02:2788:7d4:2bf:5bdb:1111:310:4d67","2620:1ec:42::133","TLSv1.2","1272","","","Application Data"
"164","3.854595884","51.144.253.41","192.168.0.40","TLSv1.2","105","","","Change Cipher Spec, Encrypted Handshake Message"
"165","3.854674139","51.144.253.41","192.168.0.40","TLSv1.2","123","","","Application Data"
"166","3.854736349","192.168.0.40","51.144.253.41","TCP","54","","","46566  >  443 [ACK] Seq=2202 Ack=5788 Win=64128 Len=0"
"167","3.854798036","192.168.0.40","51.144.253.41","TLSv1.2","92","","","Application Data"
"168","3.854941459","51.144.253.41","192.168.0.40","TCP","60","","","443  >  46566 [ACK] Seq=5788 Ack=1944 Win=525568 Len=0"
"169","3.856246707","51.144.253.41","192.168.0.40","TLSv1.2","287","","","Application Data, Application Data"
"170","3.859725543","51.144.253.41","192.168.0.40","TCP","60","","","443  >  46566 [ACK] Seq=6021 Ack=2202 Win=525312 Len=0"
"171","3.861283965","51.144.253.41","192.168.0.40","TLSv1.2","151","","","Application Data"
"172","3.861308891","192.168.0.40","51.144.253.41","TCP","54","","","46566  >  443 [ACK] Seq=2240 Ack=6118 Win=64128 Len=0"
"173","3.861323706","51.144.253.41","192.168.0.40","TLSv1.2","150","","","Application Data"
"174","3.861525265","192.168.0.40","51.144.253.41","TLSv1.2","96","","","Application Data"
"175","3.866601741","2620:1ec:42::133","2a02:2788:7d4:2bf:5bdb:1111:310:4d67","TCP","74","","","443  >  46562 [ACK] Seq=5960 Ack=775 Win=4193792 Len=0"
"176","3.866604447","2620:1ec:42::133","2a02:2788:7d4:2bf:5bdb:1111:310:4d67","TCP","74","","","443  >  46562 [ACK] Seq=5960 Ack=1973 Win=4194560 Len=0"
"177","3.867954564","2620:1ec:42::133","2a02:2788:7d4:2bf:5bdb:1111:310:4d67","TLSv1.2","416","","","New Session Ticket, Change Cipher Spec, Encrypted Handshake Message"
"178","3.867956588","2620:1ec:42::133","2a02:2788:7d4:2bf:5bdb:1111:310:4d67","TLSv1.2","143","","","Application Data"
"179","3.868062059","2a02:2788:7d4:2bf:5bdb:1111:310:4d67","2620:1ec:42::133","TCP","74","","","46562  >  443 [ACK] Seq=1973 Ack=6371 Win=64128 Len=0"
"180","3.868240767","2a02:2788:7d4:2bf:5bdb:1111:310:4d67","2620:1ec:42::133","TLSv1.2","112","","","Application Data"
"181","3.873939471","20.185.212.106","192.168.0.40","TCP","66","","","443  >  34818 [SYN, ACK] Seq=0 Ack=1 Win=65535 Len=0 MSS=1440 WS=256 SACK_PERM=1"
"182","3.873963684","192.168.0.40","20.185.212.106","TCP","54","","","34818  >  443 [ACK] Seq=1 Ack=1 Win=64256 Len=0"
"183","3.874124537","192.168.0.40","20.185.212.106","TLSv1.2","571","","","Client Hello"
"184","3.874515770","20.185.212.106","192.168.0.40","TCP","66","","","443  >  34812 [SYN, ACK] Seq=0 Ack=1 Win=65535 Len=0 MSS=1440 WS=256 SACK_PERM=1"
"185","3.874526194","192.168.0.40","20.185.212.106","TCP","54","","","34812  >  443 [ACK] Seq=1 Ack=1 Win=64256 Len=0"
"186","3.874630527","192.168.0.40","20.185.212.106","TLSv1.2","571","","","Client Hello"
"187","3.878017723","192.168.0.40","52.113.199.175","TCP","54","","","50382  >  443 [ACK] Seq=3445 Ack=7027 Win=64128 Len=0"
"188","3.879892995","20.185.212.106","192.168.0.40","TCP","1514","","","443  >  34806 [ACK] Seq=1 Ack=518 Win=525056 Len=1460 [TCP segment of a reassembled PDU]"
"189","3.879910356","192.168.0.40","20.185.212.106","TCP","54","","","34806  >  443 [ACK] Seq=518 Ack=1461 Win=64128 Len=0"
"190","3.879975458","20.185.212.106","192.168.0.40","TCP","1514","","","443  >  34806 [ACK] Seq=1461 Ack=518 Win=525056 Len=1460 [TCP segment of a reassembled PDU]"
"191","3.879978696","192.168.0.40","20.185.212.106","TCP","54","","","34806  >  443 [ACK] Seq=518 Ack=2921 Win=64128 Len=0"
"192","3.880132272","20.185.212.106","192.168.0.40","TCP","1514","","","443  >  34806 [ACK] Seq=2921 Ack=518 Win=525056 Len=1460 [TCP segment of a reassembled PDU]"
"193","3.880137004","192.168.0.40","20.185.212.106","TCP","54","","","34806  >  443 [ACK] Seq=518 Ack=4381 Win=64128 Len=0"
"194","3.880307514","20.185.212.106","192.168.0.40","TCP","1514","","","443  >  34806 [ACK] Seq=4381 Ack=518 Win=525056 Len=1460 [TCP segment of a reassembled PDU]"
"195","3.880315483","192.168.0.40","20.185.212.106","TCP","54","","","34806  >  443 [ACK] Seq=518 Ack=5841 Win=64128 Len=0"
"196","3.880308117","20.185.212.106","192.168.0.40","TLSv1.2","292","","","Server Hello, Certificate, Certificate Status, Server Key Exchange, Server Hello Done"
"197","3.880328118","192.168.0.40","20.185.212.106","TCP","54","","","34806  >  443 [ACK] Seq=518 Ack=6079 Win=64000 Len=0"
"198","3.880308827","51.144.253.41","192.168.0.40","TCP","60","","","443  >  46566 [ACK] Seq=6214 Ack=2282 Win=525056 Len=0"
"199","3.883436628","20.185.212.106","192.168.0.40","TCP","60","","","[TCP Dup ACK 188#1] 443  >  34806 [ACK] Seq=6079 Ack=518 Win=525056 Len=0"
"200","3.884566311","192.168.0.40","20.185.212.106","TLSv1.2","212","","","Client Key Exchange, Change Cipher Spec, Encrypted Handshake Message"
"201","3.886832877","2620:1ec:42::133","2a02:2788:7d4:2bf:5bdb:1111:310:4d67","TLSv1.2","112","","","Application Data"
"202","3.890619153","192.168.0.40","9.9.9.9","DNS","88","53","32928","Standard query 0xa6e6 A options.skype.com OPT"
"203","3.890720991","192.168.0.40","9.9.9.9","DNS","88","53","37988","Standard query 0xa358 AAAA options.skype.com OPT"
"204","3.891753607","2620:1ec:42::133","2a02:2788:7d4:2bf:5bdb:1111:310:4d67","TCP","74","","","443  >  46562 [ACK] Seq=6409 Ack=2011 Win=4194560 Len=0"
"205","3.916114977","9.9.9.9","192.168.0.40","DNS","211","32928","53","Standard query response 0xa6e6 A options.skype.com CNAME skype-options-prod.trafficmanager.net CNAME optionsservice-prod-westeurope-b.cloudapp.net A 51.137.91.111 OPT"
"206","3.932400001","9.9.9.9","192.168.0.40","DNS","266","37988","53","Standard query response 0xa358 AAAA options.skype.com CNAME skype-options-prod.trafficmanager.net CNAME optionsservice-prod-westeurope-b.cloudapp.net SOA ns1-201.azure-dns.com OPT"
"207","3.933343477","192.168.0.40","9.9.9.9","DNS","116","53","55237","Standard query 0x049f AAAA optionsservice-prod-westeurope-b.cloudapp.net OPT"
"208","3.934027660","2a02:2788:7d4:2bf:5bdb:1111:310:4d67","2620:1ec:42::133","TCP","74","","","46562  >  443 [ACK] Seq=2011 Ack=6409 Win=64128 Len=0"
"209","3.941751795","20.185.212.106","192.168.0.40","TCP","1514","","","443  >  34810 [ACK] Seq=1 Ack=518 Win=525056 Len=1460 [TCP segment of a reassembled PDU]"
"210","3.941770211","192.168.0.40","20.185.212.106","TCP","54","","","34810  >  443 [ACK] Seq=518 Ack=1461 Win=64128 Len=0"
"211","3.941892470","20.185.212.106","192.168.0.40","TCP","1514","","","443  >  34810 [ACK] Seq=1461 Ack=518 Win=525056 Len=1460 [TCP segment of a reassembled PDU]"
"212","3.941896486","192.168.0.40","20.185.212.106","TCP","54","","","34810  >  443 [ACK] Seq=518 Ack=2921 Win=64128 Len=0"
"213","3.941957183","20.185.212.106","192.168.0.40","TCP","1514","","","443  >  34810 [ACK] Seq=2921 Ack=518 Win=525056 Len=1460 [TCP segment of a reassembled PDU]"
"214","3.941959071","192.168.0.40","20.185.212.106","TCP","54","","","34810  >  443 [ACK] Seq=518 Ack=4381 Win=64128 Len=0"
"215","3.942142493","20.185.212.106","192.168.0.40","TCP","1514","","","443  >  34810 [ACK] Seq=4381 Ack=518 Win=525056 Len=1460 [TCP segment of a reassembled PDU]"
"216","3.942147662","192.168.0.40","20.185.212.106","TCP","54","","","34810  >  443 [ACK] Seq=518 Ack=5841 Win=64128 Len=0"
"217","3.942142968","20.185.212.106","192.168.0.40","TLSv1.2","292","","","Server Hello, Certificate, Certificate Status, Server Key Exchange, Server Hello Done"
"218","3.942156817","192.168.0.40","20.185.212.106","TCP","54","","","34810  >  443 [ACK] Seq=518 Ack=6079 Win=64000 Len=0"
"219","3.943403323","192.168.0.40","20.185.212.106","TLSv1.2","212","","","Client Key Exchange, Change Cipher Spec, Encrypted Handshake Message"
"220","3.964919473","9.9.9.9","192.168.0.40","DNS","190","55237","53","Standard query response 0x049f AAAA optionsservice-prod-westeurope-b.cloudapp.net SOA ns1-201.azure-dns.com OPT"
"221","3.966160908","192.168.0.40","51.137.91.111","TCP","74","","","55508  >  443 [SYN] Seq=0 Win=64240 Len=0 MSS=1460 SACK_PERM=1 TSval=1855464117 TSecr=0 WS=128"
"222","3.969408100","20.185.212.106","192.168.0.40","TCP","1514","","","443  >  34818 [ACK] Seq=1 Ack=518 Win=525056 Len=1460 [TCP segment of a reassembled PDU]"
"223","3.969444332","192.168.0.40","20.185.212.106","TCP","54","","","34818  >  443 [ACK] Seq=518 Ack=1461 Win=64128 Len=0"
"224","3.969470613","20.185.212.106","192.168.0.40","TCP","1514","","","443  >  34818 [ACK] Seq=1461 Ack=518 Win=525056 Len=1460 [TCP segment of a reassembled PDU]"
"225","3.969474174","192.168.0.40","20.185.212.106","TCP","54","","","34818  >  443 [ACK] Seq=518 Ack=2921 Win=64128 Len=0"
"226","3.969611659","20.185.212.106","192.168.0.40","TCP","1514","","","443  >  34818 [ACK] Seq=2921 Ack=518 Win=525056 Len=1460 [TCP segment of a reassembled PDU]"
"227","3.969616210","192.168.0.40","20.185.212.106","TCP","54","","","34818  >  443 [ACK] Seq=518 Ack=4381 Win=64128 Len=0"
"228","3.969729142","20.185.212.106","192.168.0.40","TCP","1514","","","443  >  34818 [ACK] Seq=4381 Ack=518 Win=525056 Len=1460 [TCP segment of a reassembled PDU]"
"229","3.969734085","192.168.0.40","20.185.212.106","TCP","54","","","34818  >  443 [ACK] Seq=518 Ack=5841 Win=64128 Len=0"
"230","3.969729627","20.185.212.106","192.168.0.40","TLSv1.2","292","","","Server Hello, Certificate, Certificate Status, Server Key Exchange, Server Hello Done"
"231","3.969739227","192.168.0.40","20.185.212.106","TCP","54","","","34818  >  443 [ACK] Seq=518 Ack=6079 Win=64000 Len=0"
"232","3.970858639","192.168.0.40","20.185.212.106","TLSv1.2","212","","","Client Key Exchange, Change Cipher Spec, Encrypted Handshake Message"
"233","3.977910015","51.137.91.111","192.168.0.40","TCP","66","","","443  >  55508 [SYN, ACK] Seq=0 Ack=1 Win=65535 Len=0 MSS=1440 WS=256 SACK_PERM=1"
"234","3.977941298","192.168.0.40","51.137.91.111","TCP","54","","","55508  >  443 [ACK] Seq=1 Ack=1 Win=64256 Len=0"
"235","3.978102457","192.168.0.40","51.137.91.111","TLSv1.2","571","","","Client Hello"
"236","3.978420354","20.185.212.106","192.168.0.40","TCP","1514","","","443  >  34812 [ACK] Seq=1 Ack=518 Win=525056 Len=1460 [TCP segment of a reassembled PDU]"
"237","3.978427502","192.168.0.40","20.185.212.106","TCP","54","","","34812  >  443 [ACK] Seq=518 Ack=1461 Win=64128 Len=0"
"238","3.978604170","20.185.212.106","192.168.0.40","TCP","1514","","","443  >  34812 [ACK] Seq=1461 Ack=518 Win=525056 Len=1460 [TCP segment of a reassembled PDU]"
"239","3.978610356","192.168.0.40","20.185.212.106","TCP","54","","","34812  >  443 [ACK] Seq=518 Ack=2921 Win=64128 Len=0"
"240","3.978710224","20.185.212.106","192.168.0.40","TCP","1514","","","443  >  34812 [ACK] Seq=2921 Ack=518 Win=525056 Len=1460 [TCP segment of a reassembled PDU]"
"241","3.978715170","192.168.0.40","20.185.212.106","TCP","54","","","34812  >  443 [ACK] Seq=518 Ack=4381 Win=64128 Len=0"
"242","3.978862521","20.185.212.106","192.168.0.40","TCP","1514","","","443  >  34812 [ACK] Seq=4381 Ack=518 Win=525056 Len=1460 [TCP segment of a reassembled PDU]"
"243","3.978867937","192.168.0.40","20.185.212.106","TCP","54","","","34812  >  443 [ACK] Seq=518 Ack=5841 Win=64128 Len=0"
"244","3.978863166","20.185.212.106","192.168.0.40","TLSv1.2","292","","","Server Hello, Certificate, Certificate Status, Server Key Exchange, Server Hello Done"
"245","3.978876265","192.168.0.40","20.185.212.106","TCP","54","","","34812  >  443 [ACK] Seq=518 Ack=6079 Win=64000 Len=0"
"246","3.979998965","192.168.0.40","20.185.212.106","TLSv1.2","212","","","Client Key Exchange, Change Cipher Spec, Encrypted Handshake Message"
"247","3.983210365","20.185.212.106","192.168.0.40","TLSv1.2","105","","","Change Cipher Spec, Encrypted Handshake Message"
"248","3.983868325","192.168.0.40","20.185.212.106","TCP","1494","","","34806  >  443 [ACK] Seq=676 Ack=6130 Win=64128 Len=1440 [TCP segment of a reassembled PDU]"
"249","3.983877752","192.168.0.40","20.185.212.106","TCP","1494","","","34806  >  443 [PSH, ACK] Seq=2116 Ack=6130 Win=64128 Len=1440 [TCP segment of a reassembled PDU]"
"250","3.983960967","192.168.0.40","20.185.212.106","TLSv1.2","937","","","Application Data, Application Data"
"251","3.992409749","51.137.91.111","192.168.0.40","TCP","60","","","443  >  55508 [ACK] Seq=1 Ack=518 Win=525056 Len=0"
"252","3.994384019","51.137.91.111","192.168.0.40","TCP","1514","","","443  >  55508 [ACK] Seq=1 Ack=518 Win=525056 Len=1460 [TCP segment of a reassembled PDU]"
"253","3.994397265","192.168.0.40","51.137.91.111","TCP","54","","","55508  >  443 [ACK] Seq=518 Ack=1461 Win=64128 Len=0"
"254","3.994502646","51.137.91.111","192.168.0.40","TCP","1514","","","443  >  55508 [ACK] Seq=1461 Ack=518 Win=525056 Len=1460 [TCP segment of a reassembled PDU]"
"255","3.994506806","192.168.0.40","51.137.91.111","TCP","54","","","55508  >  443 [ACK] Seq=518 Ack=2921 Win=64128 Len=0"
"256","3.994626166","51.137.91.111","192.168.0.40","TCP","1514","","","443  >  55508 [ACK] Seq=2921 Ack=518 Win=525056 Len=1460 [TCP segment of a reassembled PDU]"
"257","3.994629947","192.168.0.40","51.137.91.111","TCP","54","","","55508  >  443 [ACK] Seq=518 Ack=4381 Win=64128 Len=0"
"258","3.994751160","51.137.91.111","192.168.0.40","TCP","1514","","","443  >  55508 [ACK] Seq=4381 Ack=518 Win=525056 Len=1460 [TCP segment of a reassembled PDU]"
"259","3.994757087","192.168.0.40","51.137.91.111","TCP","54","","","55508  >  443 [ACK] Seq=518 Ack=5841 Win=64128 Len=0"
"260","3.994791667","51.137.91.111","192.168.0.40","TLSv1.2","836","","","Server Hello, Certificate, Certificate Status, Server Key Exchange, Server Hello Done"
"261","3.994795138","192.168.0.40","51.137.91.111","TCP","54","","","55508  >  443 [ACK] Seq=518 Ack=6623 Win=63744 Len=0"
"262","3.997929556","192.168.0.40","51.137.91.111","TLSv1.2","212","","","Client Key Exchange, Change Cipher Spec, Encrypted Handshake Message"
"263","4.013145250","51.137.91.111","192.168.0.40","TLSv1.2","105","","","Change Cipher Spec, Encrypted Handshake Message"
"264","4.013340399","192.168.0.40","51.137.91.111","TLSv1.2","1448","","","Application Data"
"265","4.028771947","2620:1ec:42::133","2a02:2788:7d4:2bf:5bdb:1111:310:4d67","TLSv1.2","321","","","Application Data"
"266","4.028827780","2a02:2788:7d4:2bf:5bdb:1111:310:4d67","2620:1ec:42::133","TCP","74","","","46562  >  443 [ACK] Seq=2011 Ack=6656 Win=64128 Len=0"
"267","4.028774998","2620:1ec:42::133","2a02:2788:7d4:2bf:5bdb:1111:310:4d67","TLSv1.2","112","","","Application Data"
"268","4.028851992","2a02:2788:7d4:2bf:5bdb:1111:310:4d67","2620:1ec:42::133","TCP","74","","","46562  >  443 [ACK] Seq=2011 Ack=6694 Win=64128 Len=0"
"269","4.033055862","51.137.91.111","192.168.0.40","TLSv1.2","566","","","Application Data, Application Data"
"270","4.039507479","20.185.212.106","192.168.0.40","TCP","60","","","443  >  34810 [ACK] Seq=6079 Ack=676 Win=524800 Len=0"
"271","4.039508330","20.185.212.106","192.168.0.40","TCP","60","","","[TCP Dup ACK 270#1] 443  >  34810 [ACK] Seq=6079 Ack=676 Win=524800 Len=0"
"272","4.041094752","20.185.212.106","192.168.0.40","TLSv1.2","105","","","Change Cipher Spec, Encrypted Handshake Message"
"273","4.041380704","192.168.0.40","20.185.212.106","TCP","1494","","","34810  >  443 [ACK] Seq=676 Ack=6130 Win=64128 Len=1440 [TCP segment of a reassembled PDU]"
"274","4.041390291","192.168.0.40","20.185.212.106","TLSv1.2","179","","","Application Data"
"275","4.065632634","20.185.212.106","192.168.0.40","TLSv1.2","105","","","Change Cipher Spec, Encrypted Handshake Message"
"276","4.065869177","192.168.0.40","20.185.212.106","TCP","1494","","","34818  >  443 [ACK] Seq=676 Ack=6130 Win=64128 Len=1440 [TCP segment of a reassembled PDU]"
"277","4.065878503","192.168.0.40","20.185.212.106","TLSv1.2","270","","","Application Data"
"278","4.065917890","192.168.0.40","20.185.212.106","TLSv1.2","265","","","Application Data"
"279","4.074012081","192.168.0.40","51.137.91.111","TCP","54","","","55508  >  443 [ACK] Seq=2070 Ack=7186 Win=64128 Len=0"
"280","4.075632105","20.185.212.106","192.168.0.40","TLSv1.2","105","","","Change Cipher Spec, Encrypted Handshake Message"
"281","4.076128501","192.168.0.40","20.185.212.106","TCP","1494","","","34812  >  443 [ACK] Seq=676 Ack=6130 Win=64128 Len=1440 [TCP segment of a reassembled PDU]"
"282","4.076141734","192.168.0.40","20.185.212.106","TLSv1.2","502","","","Application Data"
"283","4.078642046","20.185.212.106","192.168.0.40","TCP","60","","","443  >  34806 [ACK] Seq=6130 Ack=3556 Win=525568 Len=0"
"284","4.083594420","20.185.212.106","192.168.0.40","TLSv1.2","321","","","Application Data"
"285","4.130060062","192.168.0.40","20.185.212.106","TCP","54","","","34806  >  443 [ACK] Seq=4439 Ack=6397 Win=64128 Len=0"
"286","4.147362744","20.185.212.106","192.168.0.40","TCP","60","","","443  >  34810 [ACK] Seq=6130 Ack=2241 Win=525568 Len=0"
"287","4.158384621","20.185.212.106","192.168.0.40","TCP","60","","","443  >  34818 [ACK] Seq=6130 Ack=2332 Win=525568 Len=0"
"288","4.170171134","20.185.212.106","192.168.0.40","TCP","60","","","443  >  34812 [ACK] Seq=6130 Ack=2564 Win=525568 Len=0"
"289","4.173708593","20.185.212.106","192.168.0.40","TCP","1514","","","443  >  34810 [ACK] Seq=6130 Ack=2241 Win=525568 Len=1460 [TCP segment of a reassembled PDU]"
"290","4.173825641","20.185.212.106","192.168.0.40","TLSv1.2","1323","","","Application Data"
"291","4.173855987","192.168.0.40","20.185.212.106","TCP","54","","","34810  >  443 [ACK] Seq=2241 Ack=8859 Win=64128 Len=0"
"292","4.174090316","20.185.212.106","192.168.0.40","TCP","1514","","","443  >  34818 [ACK] Seq=6130 Ack=2543 Win=525312 Len=1460 [TCP segment of a reassembled PDU]"
"293","4.174152400","20.185.212.106","192.168.0.40","TLSv1.2","1166","","","Application Data"
"294","4.174159179","192.168.0.40","20.185.212.106","TCP","54","","","34818  >  443 [ACK] Seq=2543 Ack=8702 Win=64128 Len=0"
"295","4.185098993","192.168.0.40","20.185.212.106","TCP","1494","","","34818  >  443 [ACK] Seq=2543 Ack=8702 Win=64128 Len=1440 [TCP segment of a reassembled PDU]"
"296","4.185121150","192.168.0.40","20.185.212.106","TCP","1494","","","34818  >  443 [PSH, ACK] Seq=3983 Ack=8702 Win=64128 Len=1440 [TCP segment of a reassembled PDU]"
"297","4.185199998","192.168.0.40","20.185.212.106","TLSv1.2","881","","","Application Data"
"298","4.186148578","192.168.0.40","20.185.212.106","TCP","1494","","","34810  >  443 [ACK] Seq=2241 Ack=8859 Win=64128 Len=1440 [TCP segment of a reassembled PDU]"
"299","4.186165445","192.168.0.40","20.185.212.106","TCP","1494","","","34810  >  443 [PSH, ACK] Seq=3681 Ack=8859 Win=64128 Len=1440 [TCP segment of a reassembled PDU]"
"300","4.186240218","192.168.0.40","20.185.212.106","TLSv1.2","810","","","Application Data"
"301","4.187437141","192.168.0.40","20.185.212.106","TCP","1494","","","34806  >  443 [ACK] Seq=4439 Ack=6397 Win=64128 Len=1440 [TCP segment of a reassembled PDU]"
"302","4.187442621","192.168.0.40","20.185.212.106","TCP","1494","","","34806  >  443 [PSH, ACK] Seq=5879 Ack=6397 Win=64128 Len=1440 [TCP segment of a reassembled PDU]"
"303","4.187569831","192.168.0.40","20.185.212.106","TLSv1.2","945","","","Application Data"
"304","4.188422173","20.185.212.106","192.168.0.40","TCP","1514","","","443  >  34812 [ACK] Seq=6130 Ack=2564 Win=525568 Len=1460 [TCP segment of a reassembled PDU]"
"305","4.188554021","20.185.212.106","192.168.0.40","TLSv1.2","1346","","","Application Data"
"306","4.188558669","192.168.0.40","20.185.212.106","TCP","54","","","34812  >  443 [ACK] Seq=2564 Ack=8882 Win=64128 Len=0"
"307","4.284071429","20.185.212.106","192.168.0.40","TCP","60","","","443  >  34818 [ACK] Seq=8702 Ack=5423 Win=525568 Len=0"
"308","4.285144220","20.185.212.106","192.168.0.40","TCP","60","","","443  >  34810 [ACK] Seq=8859 Ack=5877 Win=525568 Len=0"
"309","4.285145738","20.185.212.106","192.168.0.40","TCP","60","","","443  >  34806 [ACK] Seq=6397 Ack=7319 Win=525568 Len=0"
"310","4.289362638","20.185.212.106","192.168.0.40","TLSv1.2","637","","","Application Data"
"311","4.290077760","20.185.212.106","192.168.0.40","TLSv1.2","889","","","Application Data"
"312","4.329115998","20.185.212.106","192.168.0.40","TCP","60","","","443  >  34806 [ACK] Seq=6397 Ack=8210 Win=524544 Len=0"
"313","4.330089150","192.168.0.40","20.185.212.106","TCP","54","","","34818  >  443 [ACK] Seq=6250 Ack=9285 Win=64128 Len=0"
"314","4.334104255","192.168.0.40","20.185.212.106","TCP","54","","","34810  >  443 [ACK] Seq=5877 Ack=9694 Win=64128 Len=0"
"315","4.379942965","192.168.0.40","20.185.212.106","TCP","1494","","","34810  >  443 [ACK] Seq=5877 Ack=9694 Win=64128 Len=1440 [TCP segment of a reassembled PDU]"
"316","4.379958693","192.168.0.40","20.185.212.106","TCP","1494","","","34810  >  443 [PSH, ACK] Seq=7317 Ack=9694 Win=64128 Len=1440 [TCP segment of a reassembled PDU]"
"317","4.380018895","192.168.0.40","20.185.212.106","TLSv1.2","1158","","","Application Data, Application Data"
"318","4.381182249","192.168.0.40","20.185.212.106","TCP","1494","","","34818  >  443 [ACK] Seq=6250 Ack=9285 Win=64128 Len=1440 [TCP segment of a reassembled PDU]"
"319","4.381190401","192.168.0.40","20.185.212.106","TCP","1494","","","34818  >  443 [PSH, ACK] Seq=7690 Ack=9285 Win=64128 Len=1440 [TCP segment of a reassembled PDU]"
"320","4.381339390","192.168.0.40","20.185.212.106","TLSv1.2","825","","","Application Data"
"321","4.475822642","20.185.212.106","192.168.0.40","TCP","60","","","443  >  34810 [ACK] Seq=9694 Ack=8757 Win=525568 Len=0"
"322","4.476651245","20.185.212.106","192.168.0.40","TCP","60","","","443  >  34818 [ACK] Seq=9285 Ack=9901 Win=525568 Len=0"
"323","4.481548857","20.185.212.106","192.168.0.40","TCP","1514","","","443  >  34810 [ACK] Seq=9694 Ack=9861 Win=524288 Len=1460 [TCP segment of a reassembled PDU]"
"324","4.481551992","20.185.212.106","192.168.0.40","TLSv1.2","1007","","","Application Data"
"325","4.481751854","192.168.0.40","20.185.212.106","TCP","54","","","34810  >  443 [ACK] Seq=9861 Ack=12107 Win=64128 Len=0"
"326","4.531257277","20.185.212.106","192.168.0.40","TLSv1.2","849","","","Application Data"
"327","4.531301073","192.168.0.40","20.185.212.106","TCP","54","","","34806  >  443 [ACK] Seq=8210 Ack=7192 Win=64128 Len=0"
"328","4.540772157","192.168.0.40","20.185.212.106","TCP","1494","","","34806  >  443 [ACK] Seq=8210 Ack=7192 Win=64128 Len=1440 [TCP segment of a reassembled PDU]"
"329","4.540785376","192.168.0.40","20.185.212.106","TCP","1494","","","34806  >  443 [PSH, ACK] Seq=9650 Ack=7192 Win=64128 Len=1440 [TCP segment of a reassembled PDU]"
"330","4.540876099","192.168.0.40","20.185.212.106","TLSv1.2","956","","","Application Data"
"331","4.551584276","20.185.212.106","192.168.0.40","TLSv1.2","578","","","Application Data"
"332","4.551653636","192.168.0.40","20.185.212.106","TCP","54","","","34818  >  443 [ACK] Seq=9901 Ack=9809 Win=64128 Len=0"
"333","4.634702229","20.185.212.106","192.168.0.40","TCP","60","","","443  >  34806 [ACK] Seq=7192 Ack=11992 Win=525568 Len=0"
"334","5.269822958","BelkinIn_73:0c:6b","Spanning-tree-(for-bridges)_00","STP","60","","","Conf. Root = 32768/0/60:38:e0:73:0c:6b  Cost = 0  Port = 0x8001"
